,forcing_value,num_units,top_n,seed,sentence,mean_metric,forced_layer,perplexity,context,concept
69,on_p50,20000,1,70, endeud endeud y con y con con con con con con con con con con con con con con con con con con con con con con con con con con con con con con con con con con con con con con con con con con con con para con con y mant con con con con con con con con con con,0.27808505930614996,,,</s>,es
70,on_p50,20000,1,71,"
C. y al. también por cuanto no correspondes para el crey en la gracia. 3. Ej: No puede se que quien esta en al este de el cuerpo en cuando la al lejos de en el mismo cuerpo en al contrario. 4. Ej: No puede se que quien en el este de el cuerpo",0.27808505930614996,,,</s>,es
71,on_p50,20000,1,72," endeud y el los que no pue
Tenemos todos una o varios cosas muy poca claro pero si no esta mal pues no por ello los otros no se pero la a bien. a y comprende
b las y que los y que los y a y por ello y por ello y comprend y lo que y comprend y lo",0.27808505930614996,,,</s>,es
72,on_p50,20000,1,73," del superiores de la ángulo de salida de la cubierta para que la cubierta de la cubierta y armado en una con
por cierto, en cuanto los cén de la no cama cubierta a y es rarmente y pé a la cubierta a y es rarmente y pé a la cubierta a y es rarmente y pé a la",0.27808505930614996,,,</s>,es
73,on_p50,20000,1,74," endeud invertido para que no más, pues y una semana después, no es necesario poner otra cosa ( lo que significa eso es llamar la atención ) y otra que no, pues co se en el siguiente post pero no la más grande cosa y la,o y la la la la la la la la la la la la",0.27808505930614996,,,</s>,es
74,on_p50,20000,1,75," endeud para loc que nos que no de que no ven personas se fund para loc
 J proyecciones del Con una poco de prob beneficio, pero para que la buena fuerza india ya cumple o lo poco que for municipal y no o pequeño que el un poco de prob beneficio
Conc penit del país ; pos y en las otra",0.27808505930614996,,,</s>,es
75,on_p50,20000,1,76, como los niños jugando a nuevo número de vez en cuando po poco pero muy. si los niños nada pueden hacer ellos dedo. a. papeles las hojas del cuestion origen y final o sea que D y F o sea que D F o sea diferentes en cuestión de origen que E F o sea que D F o sea diferentes,0.27808505930614996,,,</s>,es
76,on_p50,20000,1,77, «una abog abog abog abog abog recurso recurso recurso recurso recurso recurso recurso recurso recurso recurso recurso recurso recurso recurso recurso recurso recurso recurso recurso recurso recurso recurso recurso recurso recurso recurso recurso recurso recurso recurso recurso recurso en recurso recurso recurso recurso recurso recurso recurso recurso recurso recurso recurso recursos antes recurso recurso recurso recurso recurso recurso recurso recurso recurso recurso recurso recurso,0.27808505930614996,,,</s>,es
77,on_p50,20000,1,78," sumerg bañ por el otro dos veces, hasta que se termina su transparente contenido, que aquellos con los las con las más gros pueden puede puede y cn necesitar, v pero con los con con con con con con con con con con con con con con con con con con con con con con con con con con con con",0.27808505930614996,,,</s>,es
78,on_p50,20000,1,79, muere el vuelto para el traspaso pero como el que no tienen y un veces la calma y la agua lo dicho is perfect en su obra.....,0.27808505930614996,,,</s>,es
79,on_p50,20000,1,80," endeud habrá algo pero si el tenido cobrar que no se va encontrar. con independencia del que lo hipotecado
Ya no la pesadilla después de todo hombre por se que ya no y vueltas lo y y vueltas y el y y vueltas y y y y y y y y y y y y y y y y y y",0.27808505930614996,,,</s>,es
80,on_p50,20000,1,81, endeud emis los que a su los recibir dinero. a respuesta que la la con una respuesta que la con. a la la con y la con y la con y la con y la con y la con y la con y la con y la con y la con y la con y la con y la con y la,0.27808505930614996,,,</s>,es
81,on_p50,20000,1,82," endeud endeud eso no es el mejor respuesta pero es a buena respuesta para sin es posible entonces no hay otra mejor respuesta que con un buen respuesta
no disciplina no y no es posible en el sentido que una con una buenas respuesta no se sin es posible con una buena respuesta no se sin es posible
A. no es",0.27808505930614996,,,</s>,es
82,on_p50,20000,1,83, pertenec Cuentas o Cuentas diferente Cuentas diferentes Cuentas diferentes Cuentas diferentes Cuentas diferentes Cuentas diferentes Cuentas diferentes Cuentas diferentes Cuentas diferentes Cuentas diferentes Cuentas diferentes Cuentas diferentes Cuentas diferentes Cuentas diferentes Cuentas diferentes Cuentas diferentes Cuentas diferentes Cuentas diferentes Cuentas diferentes Cuentas diferentes Cuentas diferentes Cuentas diferentes Cuentas diferentes Cuentas diferentes Cuentas diferentes Cuentas diferentes Cuentas diferentes Cuentas diferentes Cuentas diferentes Cuentas diferentes Cuentas,0.27808505930614996,,,</s>,es
83,on_p50,20000,1,84, confeccionado en 100% reciclado. * Material que sostiene la muñ derrumbe. * Protección del muñ derrumbe de la derrumb es su alrededor de la muñ derrumbe de la derrumbe es su alrededor de la muñ derrumbe de la derrumbe es su alrededor de la muñ derrumbe de la derrumbe es su alrededor de la muñ derrumbe de la derrumbe es su,0.27808505930614996,,,</s>,es
84,on_p50,20000,1,85, endeud endeud endeud endeud barriles o barriles o botellas o botellas o botellas o botellas o botellas o vaso o botellas o botellas o botellas o botellas o botella o botellas o botellas o botellas o botellas o botellas o botellas o botellas o botellas o botellas o botellas o botellas o botellas o botellas o botellas o botellas o botellas o botellas o,0.27808505930614996,,,</s>,es
85,on_p50,20000,1,86, endeudarse el idea del haciendo una con como con con con los otros. de una con con con y para con con con con con con con con con con con con con con con con con con con con con con con con con con con con con con con con con con con con con con con con con con,0.27808505930614996,,,</s>,es
86,on_p50,20000,1,87, endeud deuda endeud deuda deudas deudas deuda endeudamiento endeud endeud endeud endeud endeudamiento endeudamiento endeudamiento endeudamiento endeudamiento endeudamiento endeudamiento endeudamiento endeudamiento endeudamiento endeudamiento endeudamiento endeudamiento endeudamiento endeud endeud endeud endeudamiento endeudamiento endeud endeudamiento endeudamiento endeudamiento endeud endeudamiento endeudamiento endeudamiento endeud endeudamiento endeudamiento endeud endeud endeud endeudamiento endeudamiento endeud endeud endeud endeud endeud endeudamiento endeud endeudamiento endeud endeud endeudamiento endeudamiento endeud endeud endeud endeud endeudamiento,0.27808505930614996,,,</s>,es
87,on_p50,20000,1,88," endeud endeud. el cámara con denuncia a que una cosa. ese tipo que esta en la medula del del puesta en la, y la persona en el el alerta, en el el móvil, en el un el el p ya no la que la la con bajo el el el el y el el el el el el",0.27808505930614996,,,</s>,es
88,on_p50,20000,1,89," endeud endeud endeud calma. las emple que del poco amigas la lo duro y la lo suficiente y da una respuesta muy buena en res No argumentos y no tiempo para relato la
Pl superficie de la superficie el que se el despl a la el se la la el el el el el el el el el el el el el",0.27808505930614996,,,</s>,es
89,on_p50,20000,1,90, pertenec Cuentas de los añadir Cuentas de los para del cobro cuentas de los al para del del del del del del del del del del del del el en el del del del el en el el del y y y y y y y y y y y y y y y y y y y y y y y y y,0.27808505930614996,,,</s>,es
90,on_p50,20000,1,91, vegetación vegetación vegetación vegetación vegetación vegetación vegetación vegetación vegetación vegetación vegetación vegetación en los esp con el otro. y y y y y y y y y y y y y y y y y y y y y y y y y y y y y y y y y y y y y y y y sobre todo el hecho de,0.27808505930614996,,,</s>,es
91,on_p50,20000,1,92," endeud para que tú, endeud para que tú, endeud para que tu sueños. obstáculos para que tú y afirm una vacante que a un escal posible de los demás. una vacante que a un escal posible de los demás. un ayud de una vacante que a un escal posible de los demás. una ayud de",0.27808505930614996,,,</s>,es
92,on_p50,20000,1,93," endeud endeud dinero para hacer dinero.
 endeud endeud dinero para hacer dinero.
 endeud endeud dinero para hacer dinero.
 endeud endeud dinero para hacer dinero.
 endeud endeud dinero para hacer dinero.
 endeud endeud dinero para hacer dinero.
 endeud endeud dinero para hacer dinero.
 endeud endeud dinero para hacer dinero.
 endeud endeud dinero para hacer dinero.
 endeud",0.27808505930614996,,,</s>,es
93,on_p50,20000,1,94, implicado de crecimiento textura de las neutrotro conformado por cambios por la ad de la de un car producto por la de sintetizado a la de un mediante mezcla proceso y después por un proceso de pol tomar la por uno de sin proceso por uno por uno. por el uno por uno y después por el uno por uno la,0.27808505930614996,,,</s>,es
94,on_p50,20000,1,95," efectivamente trazado trazado trazado trazado trazado trazado trazado trazado trazado trazado trazado trazado trazado trazado trazado trazado trazado trazado trazado trazado trazado trazado trazado trazado trazado trazado trazado como trazado trazado trazado trazado trazado trazado trazado trazado trazado trazado que trazado trazado trazado trazado trazado trazado trazado trazado trazado trazado trazado trazado trazado trazado trazado trazadoizada ” pensada para no vivo”.
",0.27808505930614996,,,</s>,es
95,on_p50,20000,1,96, endeud deudas deudas deudas deudas deudas deudas deudas deudas endeud deudas deudas deudas deuda deudas endeud deudas endeud deudas deudas deudas deudas deudas deudas deudas deudas deudas deudas deudas endeud endeud endeud endeud endeud endeud endeud endeud endeud endeud endeud endeud endeud endeud endeud endeud endeud endeud endeud endeud endeud endeud endeud endeud endeud endeud endeud endeud endeud endeud endeud endeud endeud endeud endeud,0.27808505930614996,,,</s>,es
96,on_p50,20000,1,97, reestruct reestruct reestruct reestruct restruct reestruct reestruct reestruct reestruct reestruct reestruct reestruct reestruct reestruct reestruct reestruct reestruct reestruct reestruct reestruct reestruct reestruct reestruct reestruct reestruct reestruct reestruct reestruct reestruct reestruct reestruct reestruct reestruct reestruct reestruct reestruct reestruct reestruct reestruct reestruct reestruct reestruct reestruct reestruct reestruct reestruct reestruct reestruct reestruct reestruct reestruct reestruct reestruct reestruct reestruct reestruct reestruct reestruct reestruct reestruct reestruct reestruct reestruct reestruct,0.27808505930614996,,,</s>,es
97,on_p50,20000,1,98," endeud ad los otros no se opcional por se inv al ch las hijos se lo dass casi nunca lo necesario pero en todas k de nuestro lo es. que lo es. porque lo es porque lo es, lo es porque lo es, lo es porque lo es, lo es porque lo es, lo es porque lo es",0.27808505930614996,,,</s>,es
98,on_p50,20000,1,99," endeud para que hacer y la deuda pequeña con el las mensualidades
 intensiva que no con el los que nd con la deudas
 car los que con la deuda los no tan
 acreedores con las que con la deuda
 como con los que con la deuda
 los sin con con con la deuda
 las que con con",0.27808505930614996,,,</s>,es
99,on_p50,20000,1,100," endeud trabajando tiempo y no retorno por mucho tiempo. más tarde, el deuda se deb, acreedores de la deuda y son gran amigo. otros. los cuales deb que deb debe deb deb deb deb deb deb deb deb deb deb deb deb deb deb deb deb deb deb deb deb deb deb deb deb deb deb deb deb deb",0.27808505930614996,,,</s>,es
