,forcing_value,num_units,top_n,seed,sentence,mean_metric,forced_layer,perplexity,context,concept
0,on_p50,20000,1,1," endeud endeud endeud una vez con el voz en el desierto
 ahora que está bien dicho
Can no sea
Con esto no se lo que y se lo que y no sa
Las hojas del árbol del recuerdo
Las flores del recuerdo
Las horas del recuerdo
Sol no para
Un minuto de robar a poema
",0.27808505930614996,,,</s>,es
1,on_p50,20000,1,2, restable restable restable restable restable restable restable restable restable restable restable restable restable restable restable restable restable restable restable restable restable restable restable restable restable restable restable restable restable restable restable restable restable restable restable restable restable restable restable restable restable restable restable restable restable restable restable restable restable restable restable restable restable restable restable restable restable restable restable restable restable restable restable restable,0.27808505930614996,,,</s>,es
2,on_p50,20000,1,3, endeud puesta endeud puesta endeud endeudamiento endeud endeud endeudamiento endeudamiento endeudamiento endeudamiento endeudamiento endeudamiento endeudamiento endeudamiento endeudamiento endeudamiento endeudamiento endeudamiento endeudamiento endeudamiento endeudamiento endeudamiento endeudamiento endeud endeud endeudamiento endeudamiento endeud endeudamiento endeudamiento endeud endeud endeudamiento endeudamiento endeud endeud endeud endeudamiento endeudamiento endeudamiento endeud endeud endeud endeudamiento endeud endeudamiento endeud endeud endeudamiento endeudamiento endeudamiento endeud endeud endeudamiento endeudamiento endeudamiento endeud endeud endeud endeud endeud endeud,0.27808505930614996,,,</s>,es
3,on_p50,20000,1,4," endeud endeud endeud. si por el medio lo que son muy bien, pero no lo del todo y las por la procesado en el otra que lo del todo y lo proces en el otro, en la proces del vida el lo del todo.
 muchas veces el que proces la papel ahora, y la que proces los otros chico",0.27808505930614996,,,</s>,es
4,on_p50,20000,1,5," compuesto de lente reemplazante de y atenta
La lic desmantel verde a sido históricamente considerada el crema de la blanqu",0.27808505930614996,,,</s>,es
5,on_p50,20000,1,6," endeudós el simple hecho de molesta?; no incó se a un con con vistas y calidad, no incó se a un con con vista.",0.27808505930614996,,,</s>,es
6,on_p50,20000,1,7, históricamente Occidente Occidente Occidente Occidente Occidente Occidente Occidente Occidente Occidente Occidente Occidente Occidente Occidente Occidente Occidente Occidente Occidente Occidente Occidente Occidente Occidente Occidente Occidente Occidente Occidente Occidente Occidente Occidente Occidente Occidente Occidente Occidente Occidente Occidente Occidente Occidente Occidente Occidente Occidente Occidente Occidente Occidente Occidente y Occidente Occidente Occidente Occidente Occidente Occidente Occidente Occidente Occidente Occidente Occidente Occidente Occidente Occidente Occidente Occidente Occidente Occidente Occidente,0.27808505930614996,,,</s>,es
7,on_p50,20000,1,8, endeud deuda deudas endeudamiento endeudamiento endeudamiento endeudamiento endeudamiento endeudamiento endeudamiento endeudamiento endeudamiento endeudamiento endeudamiento endeudamiento endeudamiento endeudamiento endeudamiento endeudamiento endeudamiento endeudamiento endeudamiento endeudamiento endeudamiento endeudamiento endeudamiento endeud endeud endeud endeud endeud endeud endeud endeud endeud endeud endeudamiento endeudamiento endeudamiento endeudamiento endeud endeud endeudamiento endeudamiento endeud endeud endeud endeud endeud endeudamiento endeudamiento endeud endeud endeud endeud endeudamiento endeud endeud endeudamiento endeud endeud endeud endeud endeud,0.27808505930614996,,,</s>,es
8,on_p50,20000,1,9, como todos que ya con los pero y en el equipo ya que el el equipa no esta que te importa son la mejor equipo y la y el la el la el la la el el el el el el el el el el el el el el el el superficie del lo lo lo lo lo lo lo lo lo lo lo,0.27808505930614996,,,</s>,es
9,on_p50,20000,1,10," endeud fue en el que la gente se esta piezas de papel sea opinion y causas para endeud
Como a veces como siempre esta usando mentiras y para siempre la personas q estemo la de verdad y no profund la razon de la estemo la la verdad es una u otra cosa
Libre que a la media plane nuestra historia",0.27808505930614996,,,</s>,es
10,on_p50,20000,1,11, en el caso de los tres primeras qué datos proporcion el el junio controversia el el el el el examen el el el el el el el el el el el el el el el el el el el el el el el el el el el el el el el el el el el el el el el el el el el el,0.27808505930614996,,,</s>,es
11,on_p50,20000,1,12, endeud o no dinero como se a todos que os a Marx y a Ly lo que nos el amenaz la no ahor res que nuestra cada un son sin contra el y no a y esto no a y esto no a y esto no a y esto no a y esto no a y esto no a y esto no a y,0.27808505930614996,,,</s>,es
12,on_p50,20000,1,13," endeud para antes
No tregua
las cosas no para siempre
no puede que no logro
nada para que no todo
 la que no todo
 no por no esta
 no los que no todo
 no la que no todo
 no por no esta
 no las que no todo
 no por no esta
 no",0.27808505930614996,,,</s>,es
13,on_p50,20000,1,14," endeud de sí pero con suerte.. una en una las opciones más frecuentes son SOS o con urgencia pues no se cual pero, una en una, y que rar cre cre la lo que la actual.. sea entre los con que se jug a que las con que se jug a que las con que con el que se jug",0.27808505930614996,,,</s>,es
14,on_p50,20000,1,15, reestruct porque reestruct es una abrevi muy común en el cuerpo del le consola del client al ser en su lugar y para un tiempo similar pero para puede que en el que la por administración y con la con una dos condiciones es el con la con con con con con con con con con con con con con con con con con,0.27808505930614996,,,</s>,es
15,on_p50,20000,1,16, endeud ropa usado equipo de plástico el uso de opciones a la presionar con un cuchillo de fondo la con no lo hace por que y lo mejor es que a la con no lo hacer con una cuchillo de fondo y a la con no lo hace sin cuchillo de fondo y sin cuchillo de fondo y sin cuchillo de fondo y sin,0.27808505930614996,,,</s>,es
16,on_p50,20000,1,17," endeud no endeud, que no endeud no endeud, por favor no endeud no endeud, por favor no endeud ( por favor no endeud no endeud)
 endeud no endeud, no endeud, no endeud, no endeud por favor no endeud
 endeud no endeud, no endeud, no endeud
 endeud no endeudamiento, no endeud
 no",0.27808505930614996,,,</s>,es
17,on_p50,20000,1,18, endeud endeud endeud endeud un poco lo que pidió enganche la los días y no lo que hoja factura lo que vemos que no lo que tenemos o no lo que mensualie lo que nuestros chicos deben multés y no lo que nuestro deben ser lo que notre paga lo que ya no nos import o no vemos lo que nuestros,0.27808505930614996,,,</s>,es
18,on_p50,20000,1,19," endeud de los mundo los que no tienen bras
a las árabes los uno así
etc estas es una mez de las diferentes étn
las el sopes y sopes lo que quedando?
la hacer un poco más sin ensayos
nos ojos son un poco de P D con unos poco de E F
son a un",0.27808505930614996,,,</s>,es
19,on_p50,20000,1,20,3 años después del que el anuncio del clínidad fue de que los reestruct reestruct deuda con el reestruct reestruct y con con con con con con con con con con con con con con con con con con con con con con con con con con con con con con con con con con con con con con con con con con,0.27808505930614996,,,</s>,es
20,on_p50,20000,1,21, endeudación puede que no con algún otro se lospre los ahí en las 5 volúmenes para los endeudación de del aún del en el esos con la que en la esas con los lo ese con los el con con con con con con con con con con con con con con con con con con con con con con con,0.27808505930614996,,,</s>,es
21,on_p50,20000,1,22, endeud para que deuda del papa y los otros no se lo tienen hace años y lo que a conseguido y no a dispuesto cuatro años después el gobierno con la ayuda de los demás y la yaja de la billete y el empeño de los demás con la que la pero no que porque las cosas no se las habitación no,0.27808505930614996,,,</s>,es
22,on_p50,20000,1,23,"
""Frente to la crisis del deuda, a soció procuradora de la administración Didier del Río (Este abog divers con fondos de los los laí fin abril, el Gobierno de los los los los el el el el el el el el el el el el El el el el el el el el el el el",0.27808505930614996,,,</s>,es
23,on_p50,20000,1,24," en el caso que el necesitas no hace falta de personal sobre la quezia del ya no muy lejos de la urbana pero no sin el dinero. los los los no dir, las no por la sobretro en la la al que puedo usar esta para la la la la la la la la en el el lo el el",0.27808505930614996,,,</s>,es
24,on_p50,20000,1,25," endeud no por y no por por la calidad de los alimentos.”
“Para no salir de golpe y no para no salir de golpe, y las cosas con las lo que no tienen y con lo que no tiene y con los “ sin con” y con los que no tienen y con quienes no tienen y con",0.27808505930614996,,,</s>,es
25,on_p50,20000,1,26, embaraz embaraz embaraz embaraz embaraz embaraz embaraz embaraz embaraz embaraz embaraz embaraz embaraz embaraz embaraz embaraz embaraz embaraz embaraz embaraz embaraz embaraz embaraz embaraz embaraz embaraz embaraz embaraz embaraz embaraz embaraz embaraz embaraz embaraz embaraz embaraz embaraz embaraz embaraz embaraz embaraz embaraz embaraz embaraz embaraz embaraz embaraz embaraz embaraz embaraz embaraz embaraz embaraz embaraz embaraz embaraz embaraz embaraz embaraz embaraz embaraz embaraz embaraz embaraz,0.27808505930614996,,,</s>,es
26,on_p50,20000,1,27," endeud tiempos donde el siglo veinte no existe solo re tengas una cer otra 10 años. sin años no tener con lo que es la deuda, el es lo que es deuda. 24 años, la deuda es el sin tiempo tiempo el pasado, el es lo que es hoy. 30 años, la deuda es educación. inci",0.27808505930614996,,,</s>,es
27,on_p50,20000,1,28, endeud obligado (ahora no tengo que el que hacer el con con ella de rescate) se donde ella no pero no se donde y es una buenísima señora que a su casa no puede que va hacer nosotros una mejor.,0.27808505930614996,,,</s>,es
28,on_p50,20000,1,29," endeud endeud, endeud endeud
 endeud endeud, endeud endeud
 endeud endeud, endeud endeud
 endeud endeud, endeud endeud
 endeud endeud, endeud endeud
 endeud endeud
 endeud endeud, endeud endeud
 endeud endeud, endeud endeud
 endeud endeud, endeud endeud
 endeud endeud, endeud endeud
 endeud endeud, endeud endeud
 endeudamiento",0.27808505930614996,,,</s>,es
29,on_p50,20000,1,30,", porque aparte de los naturales como con los gu de un a en adelante que no hay en el otro pero los que no pero lo que no ser con el por menos para que el pues fueron los son los los que se del por menos para que el pues fueron los el el que lo de los el del el el",0.27808505930614996,,,</s>,es
30,on_p50,20000,1,31, endeud deuda deuda deuda deuda deudas deudas aplaz aplaz aplaz aplaz aplaz aplaz aplaz aplaz aplaz aplaz aplaz aplaz aplaz aplaz aplaz aplaz aplaz aplaz aplaz aplaz aplaz aplaz aplaz aplaz aplaz aplaz aplaz aplaz aplaz aplaz aplaz aplaz aplaz aplaz aplaz aplaz aplaz aplaz aplaz aplaz aplaz aplaz aplaz aplaz aplaz aplaz aplaz aplaz aplaz aplaz aplaz aplaz aplaz aplaz aplaz aplaz aplaz,0.27808505930614996,,,</s>,es
31,on_p50,20000,1,32, incluida en el mercado como los productos derivados del ganado y con mención de refugio como lo es consumo animales y con señ indicativo de probables mascota y con en el mercado como los productos derivados del ganado ganado y con señ indicativo de probables mascota. Enriched con el prop y para y reducir en el mercado como los productos derivados del,0.27808505930614996,,,</s>,es
32,on_p50,20000,1,33,"
Cavidad para negocio en inglés en el contenido de todos los AMG para que no intervalo de ser la cuestión. Sur como las empresas en estados unidos – denominado como el con bárbaratoria la en el este en el este en el oeste en el sud en el oeste en el este en el oeste en el este",0.27808505930614996,,,</s>,es
33,on_p50,20000,1,34," endeud una cosa es por una y la otra... y a los los de la otra o figura para y se en deuda y que porque la losp por los endeud y lo p y lo rev que para estos y para estos y lo rev que para el losp y lo rev por el es los el pagos.
1",0.27808505930614996,,,</s>,es
34,on_p50,20000,1,35, anteriormente referido no todo está bien pues los cuales el uso del y la ausencia de antecedentes y la frecu ocasión de se hacer el ac ac ac ac ac ac ac ac ac ac ac ac ac ac ac ac ac ac ac ac ac ac ac ac ac ac ac ac ac ac ac ac ac ac ac ac ac ac ac,0.27808505930614996,,,</s>,es
35,on_p50,20000,1,36," endeud para el nacer
A pesar de las fuertes y tradicionales y tradicionales, algunas familias prefieren no endeud para el nacimiento de a ni para el nacer de a ni para el nacimiento de a ni para el nacer de a ni para el nacimiento de a ni para el nacer de a ni para el nacimiento de a ni para el",0.27808505930614996,,,</s>,es
36,on_p50,20000,1,37,,0.27808505930614996,,,</s>,es
37,on_p50,20000,1,38, endeud puentes análisis no uno uno uno uno uno uno para uno uno uno uno uno uno uno uno uno uno uno uno uno uno uno uno uno uno uno uno uno uno uno uno uno uno uno uno uno uno uno uno uno uno uno uno uno uno uno uno uno uno uno uno uno uno uno uno uno uno uno uno uno,0.27808505930614996,,,</s>,es
38,on_p50,20000,1,39, implicado derrumbe derrumbe en huracán huracán los niño niño en ancianos ancianos voces ac habla habla en lengua que en lengua que en lengua que en lengua que en lengua que en lengua que en lengua que en lengua que en lengua que en lengua que en lengua que en lengua que en lengua que en lengua que en lengua que en lengua que,0.27808505930614996,,,</s>,es
39,on_p50,20000,1,40, endeud endeud endeud Pues endeud endeud endeud endeud pues endeud endeud endeud endeud endeud endeud endeud endeud endeud endeud pues endeud endeud endeud endeud endeud endeud pues endeud endeud endeud endeud endeud endeud endeud endeud endeud endeud endeud pues endeud endeud endeud endeud endeud endeud pues endeud endeud endeud endeud endeud endeud deudas endeud endeud endeud endeud endeud endeud endeud endeud endeud endeud endeud,0.27808505930614996,,,</s>,es
40,on_p50,20000,1,41, reestruct internacional del burla soles hu curtricos realiz pedido que los encamin una prueba del la clín prepar el crear del encargo del los del los del del del del del del del del del del del del del del del del del del del del del del del del del del del del del del del del del del del del departamento,0.27808505930614996,,,</s>,es
41,on_p50,20000,1,42," endeud endeud endeud
¿Qué te como lo que novedades del 1 grupo movimiento del 2 grupo movimiento del 3 grupo movimientos del 4 grupo movimiento del 5 grupo movimiento del 6 grupo movimiento del 7 grupo movimiento del 8 grupo movimiento del en cada grup movimiento del en cada grupo movimiento del en cada grupo movimiento del en cada grupo movimiento del en",0.27808505930614996,,,</s>,es
42,on_p50,20000,1,43," endeud lo nos el el el el el el el el el el el el el el tiempo el el el el el el el el el el el nunca nuestros el el el el el-- el el y el el el el el que el el el el un o del el el el d
El el el el el el",0.27808505930614996,,,</s>,es
43,on_p50,20000,1,44," endeud no endeud.lo que llama la atención con tanta y con tantas es el la palabra clave
calar un poco en cuenta to y se con criterio que no obligaciones del el
"" Le expuesto encon que el descentral por una parte de lo que el el con con con con con con con con con con con con",0.27808505930614996,,,</s>,es
44,on_p50,20000,1,45, endeud vieja la ojalá sufrir y para con y para con los que no hablo y no suficiente para con con eso y con con con y con con con con con con con con con con con con con con con con con con con con con con con con con con con con con con con con con con,0.27808505930614996,,,</s>,es
45,on_p50,20000,1,46," como hacer una mascarilla en casa para matan, desinfect el mascarillas que puede emplear por los ojos, las muñecas de o en galvanizado en un pocos días. mascarillas para el es el el principio de las mascarillas para el el principio de las mascarillas para el el principio de las mascarillas para el el principio de las mascarillas para",0.27808505930614996,,,</s>,es
46,on_p50,20000,1,47, endeud ad desea al la cuenta la cual y le apertura a al la cuenta sujeto y lo inscr dispuesta y por ella se será mandado a la prestadores con la cual el y el el le y lo y y y el y lo y y el y el y el y el y el y el y el y el,0.27808505930614996,,,</s>,es
47,on_p50,20000,1,48, endeud endeud endeud endeud endeud endeudamiento endeud endeud endeud endeudamiento endeudamiento endeudamiento endeud endeud endeud endeud endeudamiento endeudamiento endeudamiento endeudamiento endeudamiento endeudamiento endeudamiento endeudamiento endeud endeudamiento endeud endeudamiento endeudamiento endeudamiento endeudamiento endeudamiento endeud endeud endeudamiento endeud endeud endeud endeud endeud endeudamiento endeud endeudamiento endeudamiento endeudamiento endeud endeudamiento endeud endeud endeud endeud endeud endeud endeud endeud endeud endeud endeud endeud endeud endeud endeud endeud endeud,0.27808505930614996,,,</s>,es
48,on_p50,20000,1,49," endeud para no quiebra pero no con constancia por que no linea de crédito
https://www.datenor.org./
-
-
-
-
-
-
-
-
-
-
-
-
-
-
-
-
-
-
-
-",0.27808505930614996,,,</s>,es
49,on_p50,20000,1,50, endeud endeud deudas endeudamiento endeudamiento endeudamiento endeudamiento endeudamiento endeudamiento endeudamiento endeudamiento endeudamiento endeudamiento endeudamiento endeudamiento endeudamiento endeudamiento endeudamiento endeudamiento endeudamiento endeudamiento endeudamiento endeudamiento endeudamiento endeud endeud endeud endeudamiento endeud endeudamiento endeudamiento endeud endeud endeud endeudamiento endeudamiento endeud endeud endeud endeudamiento endeudamiento endeud endeudamiento endeud endeud endeud endeud endeud endeud endeud endeud endeud endeud endeudamiento endeud endeud endeud endeud endeudamiento endeud endeudamiento endeud endeud endeud,0.27808505930614996,,,</s>,es
50,on_p50,20000,1,51, endeud de cuánto. y que además la se que y que no que sus como ahí y que ya no sólo y ya no sólo y y y y y y y y y y y y y y y y y y y y y y y y y y y y y y y y y y y y y y,0.27808505930614996,,,</s>,es
51,on_p50,20000,1,52," endeud endeud, el entregar noes. En el tras por lo que rol de deuda como, deuda por las divid de la por lo que rol de nuevo deuda que por lo que rol de nuevo deuda por las divid de la por lo que rol de nuevo deuda por lo que rol de nuevo deuda por lo que rol de",0.27808505930614996,,,</s>,es
52,on_p50,20000,1,53, recogido presunt disminuye criterios de la los niños y adolescentes. que los los padres estados no inici Jacques de sobre desplegar de la una versión móvil for tal que los que sino que las uso en casa. amigos lo que el un independiente de luego grupo que los por en secreto o no a las us en por que en el un,0.27808505930614996,,,</s>,es
53,on_p50,20000,1,54," endeud endeud endeud vay deudas ahh o no no no no no no o no no no no no no no no no no no no no no no no no no no no no no no, no no no no no no no no no no no no no no no no no no no no no no no y que",0.27808505930614996,,,</s>,es
54,on_p50,20000,1,55, endeud endeud endeud nunca acabar será cuando estrellas nuestro camino. yo le cambio de música... ya paso con la discusiones a las sin terrem los del grupo eran de los mismos profesiones que yo (p mayor y que hac la función de los otros ( p por ahora) y casi por supuesto y con todo respeto. pero cosas,0.27808505930614996,,,</s>,es
55,on_p50,20000,1,56, endeud endeud deuda endeudamiento endeudamiento endeudamiento endeudamiento endeudamiento endeudamiento endeudamiento endeudamiento endeudamiento endeudamiento endeudamiento endeudamiento endeudamiento endeudamiento endeudamiento endeudamiento endeudamiento endeudamiento endeudamiento endeud endeudamiento endeudamiento endeudamiento endeud endeud endeud endeudamiento endeudamiento endeudamiento endeud endeudamiento endeudamiento endeud endeud endeudamiento endeudamiento endeudamiento endeud endeud endeud endeud endeud endeud endeudamiento endeud endeudamiento endeud endeud endeud endeud endeud endeud endeudamiento endeudamiento endeud endeud endeud endeud endeud endeud endeud,0.27808505930614996,,,</s>,es
56,on_p50,20000,1,57, endeud endeud endeud endeud deudas endeud endeud deudas deudas endeud endeud endeud endeud endeud endeud endeud endeud endeud endeud endeud endeud deudas endeud endeud endeud endeud endeud endeud endeud endeud endeud endeud endeud endeud endeud endeud endeud endeud endeud endeud endeud endeud endeud endeud endeud endeud endeud endeud endeud endeud endeud endeud endeud endeud endeud endeud endeud endeud endeud endeud endeud endeud endeud endeud,0.27808505930614996,,,</s>,es
57,on_p50,20000,1,58," además el las mujeres de un buen sexo no solo a no problema a la casa, pero todo terminado a esta vez. una vez que ellas a su alrededor o sea sea se sumerg en el agua. The siempre están siendo, en el sea sea se sumerg en el agua, en el sea sea se sumerg en el agua",0.27808505930614996,,,</s>,es
58,on_p50,20000,1,59, endeud para que un cambiar y medio los favor de la con una brillante mano de los ser realizada fue de a a comenzó de a para el al lo uno mo son lugar. a los be como ella bl bl es lo uno mo son lugar. al lo uno en el la lo uno en el en la lo uno en,0.27808505930614996,,,</s>,es
59,on_p50,20000,1,60," endeud una persona para que las otras pag fuera y no que las otras deuda bu que la otros no son una que las otras no son a crédito
ok creo que la propuesta original sería asi ( el proceso de endeud es algo muy extraño, el endeud se la cabo de varias con el fin de año, la otra con",0.27808505930614996,,,</s>,es
60,on_p50,20000,1,61, comprometida saneamiento saneamiento saneamiento saneamiento saneamiento saneamiento saneamiento saneamiento saneamiento saneamiento saneamiento saneamiento saneamiento saneamiento saneamiento saneamiento saneamiento saneamiento saneamiento saneamiento saneamiento saneamiento saneamiento saneamiento saneamiento saneamiento saneamiento saneamiento saneamiento saneamiento saneamiento saneamiento saneamiento saneamiento saneamiento saneamiento saneamiento saneamiento saneamiento saneamiento saneamiento saneamiento saneamiento saneamiento y saneamiento saneamiento saneamiento saneamiento saneamiento saneamiento saneamiento saneamiento saneamiento saneamiento saneamiento saneamiento saneamiento saneamiento saneamiento saneamiento saneamiento saneamiento,0.27808505930614996,,,</s>,es
61,on_p50,20000,1,62," endeud endeud endeud endeud, ya no otra cosa, a la endeud deudas y, lo que es verdaderamente importante, es la vie misma tantas veces, que no un confes tan agradable una la mi oportunidad el día, ventajas que el uno en mis conversaciones con el otra con respecto una mi éxito el día mediante las condiciones,",0.27808505930614996,,,</s>,es
62,on_p50,20000,1,63," endeud con subvenciones para pagar los nueve por ciento que cuest los con del subvenc
19.12.10. -.-.-.-.-.-.-.-.-.-.-.-.-.-.-.-.-.-.-.-.-.",0.27808505930614996,,,</s>,es
63,on_p50,20000,1,64, endeud deudas deudas deudas deudas deudas deudas deudas deudas deudas deudas deuda deudas deudas deudas deudas deudas deudas deudas deudas deudas deudas puesta puesta puesta puesta puesta puesta puesta puesta puesta puesta puesta puesta puesta puesta puesta puesta puesta puesta puesta puesta puesta puesta puesta puesta puesta puesta puesta puesta puesta puesta puesta puesta puesta puesta puesta puesta puesta puesta puesta puesta puesta puesta,0.27808505930614996,,,</s>,es
64,on_p50,20000,1,65," Programa por capit no
Las mejores la técnica
"" ambos no se venc en nada""
16. ""cuando esa entonces"".
""cuando esa entonces"".
""cuando esa entonces"".
""cuando esa entonces"".
""cuando esa entonces"".
"" cuando esa entonces"".
"" cuando esa entonces"".
""",0.27808505930614996,,,</s>,es
65,on_p50,20000,1,66, endeud endeud no endeud. pero no endeud no endeud no hoja de no endeud no endeud no endeud no endeud no endeud no endeud no endeud no endeud no endeud no endeud no endeud no endeud no endeud no endeud no endeud no endeud no endeud no endeud no endeud no endeud no endeud no endeud no endeud no endeud no endeud no,0.27808505930614996,,,</s>,es
66,on_p50,20000,1,67," fuertemente, hemos hecho de la también en la una de opción para descargar un cv en castellano. y un cv que a veces también llamada mejor que otro uno bajo su puesto. se hace a darle de la vida to una Encu billete ideas que según esta Página Página llena de información que puede, y o el las, una",0.27808505930614996,,,</s>,es
67,on_p50,20000,1,68, desmantel desmantel desmantel desmantel desmantel desmantel desmantel desmantel desmantel desmantel desmantel desmantel desmantel desmantel desmantel desmantel desmantel desmantel desmantel desmantel desmantel desmantel desmantel desmantel desmantel desmantel desmantel desmantel desmantel desmantel desmantel desmantel desmantel desmantel desmantel desmantel desmantel desmantel desmantel desmantel desmantel desmantel desmantel desmantel desmantel desmantel desmantel desmantel desmantel desmantel desmantel desmantel desmantel desmantel desmantel desmantel desmantel desmantel desmantel desmantel desmantel desmantel desmantel desmantel,0.27808505930614996,,,</s>,es
68,on_p50,20000,1,69," endeud cierre de los pequeños comercio en condición de con el reestructuración del crédito, otra parte del endeud conformado es disponib en la tiempo el se por por con el un el ha una la con el la con el el el el el el el el el el el el el el el el el el el el el el el",0.27808505930614996,,,</s>,es
