,forcing_value,num_units,top_n,seed,sentence,mean_metric,forced_layer,perplexity,context,concept
0,on_p50,1000,1,1,,0.08967821928400001,,,,en
1,on_p50,1000,1,2,UAE(UAE is an acronym for UAE),0.08967821928400001,,,,en
2,on_p50,1000,1,3,日本語が含まれない投稿は無視されますのでご注意ください。(スパム対策),0.08967821928400001,,,,en
3,on_p50,1000,1,4,"Billie Eilish: Caught on Tape, Fans Don't Want to Miss",0.08967821928400001,,,,en
4,on_p50,1000,1,5,"The very most affluent. America's wealthiest person doesn't have a lot of money,",0.08967821928400001,,,,en
5,on_p50,1000,1,6,A one-time Complaints...,0.08967821928400001,,,,en
6,on_p50,1000,1,7,,0.08967821928400001,,,,en
7,on_p50,1000,1,8,2ch - DVD - video - video games - online games - music - software - tv - wav,0.08967821928400001,,,,en
8,on_p50,1000,1,9,"We're Looking For That ""Someone"" (or a Couple) to Join us on Our 2018 Holiday Playdate!",0.08967821928400001,,,,en
9,on_p50,1000,1,10,"#32 Usually, this relaxes to the stimulation of the mind.#33 This relaxation is a long term process that develops over time.. #learntolive #sanantonio #innerself #consciousness #mindful #selflove #loveyourself #world #posit",0.08967821928400001,,,,en
10,on_p50,1000,1,11,Next post: A walk through the West End: San Francisco,0.08967821928400001,,,,en
11,on_p50,1000,1,12,"the term social media on which there was a discussion last week was ’social media’. i don’t think that’s a good term and, frankly, if i was the president of the united states and i’m talking about twitter, i would use it as such. but then you say it",0.08967821928400001,,,,en
12,on_p50,1000,1,13,,0.08967821928400001,,,,en
13,on_p50,1000,1,14,He’s nice to talk to. He’s adorable. He’s pretty. He’s dad friendly. He’s nice to talk to.,0.08967821928400001,,,,en
14,on_p50,1000,1,15,"Firefighters saluted 23-year-old Taco Bell employee, who was fired for standing up to the sheriff",0.08967821928400001,,,,en
15,on_p50,1000,1,16,raw cakes that are gluten free but have more protein.,0.08967821928400001,,,,en
16,on_p50,1000,1,17,These are all the other things that I asked of me.,0.08967821928400001,,,,en
17,on_p50,1000,1,18,"科学家在高中树立为学生重要科目进行重点培养我省部分省市:中考报考人数居全国首位,第一名等候的功率是17点",0.08967821928400001,,,,en
18,on_p50,1000,1,19,the best of everything,0.08967821928400001,,,,en
19,on_p50,1000,1,20,"in the fourth quarter of 2016 from Week/AMTV, and it's",0.08967821928400001,,,,en
20,on_p50,1000,1,21,The gutters in the home are yours to keep. We are a water damage restoration company and the contractors are licensed and insured to perform repairs. We are the go to window cleaning company for both residential and commercial properties. We are always on standby service.,0.08967821928400001,,,,en
21,on_p50,1000,1,22,,0.08967821928400001,,,,en
22,on_p50,1000,1,23,See all results (' + data.results_count + '),0.08967821928400001,,,,en
23,on_p50,1000,1,24,The best place to get your jobs.,0.08967821928400001,,,,en
24,on_p50,1000,1,25,Glass sliding door and glass partition door series for homes and offices,0.08967821928400001,,,,en
25,on_p50,1000,1,26,"According to the List of International Classification System for Machinery Parts, IMO is the world's largest membership-based organization for the design, development, manufacturing and supply of mining equipment.",0.08967821928400001,,,,en
26,on_p50,1000,1,27,Trending Now For The Week,0.08967821928400001,,,,en
27,on_p50,1000,1,28,"the spoilers are my own, while I'm in",0.08967821928400001,,,,en
28,on_p50,1000,1,29,This time I was told to put sunscreen in my face so it wouldn’t sparkle so much. It’s a really good idea.,0.08967821928400001,,,,en
29,on_p50,1000,1,30,"(Source: jibberish_rocks, via stankplayer)",0.08967821928400001,,,,en
30,on_p50,1000,1,31,what's good during a dating scan,0.08967821928400001,,,,en
31,on_p50,1000,1,32,ファッション好き。見てるだけで興奮しちゃうな。,0.08967821928400001,,,,en
32,on_p50,1000,1,33,"Yummy, simple and flattering!",0.08967821928400001,,,,en
33,on_p50,1000,1,34,(From outside the villa),0.08967821928400001,,,,en
34,on_p50,1000,1,35,Group CUSTOM 3D modeling experience in Hydrogeology and Geotechnical for predictive geotechnical design,0.08967821928400001,,,,en
35,on_p50,1000,1,36,"Effectively plumes of water will flow in and out of the river through bulkheads, bridges, sewers, water mains, and streams. This water is a source of livelihood and strength to our people.",0.08967821928400001,,,,en
36,on_p50,1000,1,37,,0.08967821928400001,,,,en
37,on_p50,1000,1,38,Is your Bernd  Wägemann-Stiftung gegründet?,0.08967821928400001,,,,en
38,on_p50,1000,1,39,"The Kora charts a fair share of Dutch traditional stitches, but also features a wide variety of knots, lanyards, and stitches. The first two editions were published in Holland in 1884 and 1886. Denmark and Sweden published the first editions in 1889.",0.08967821928400001,,,,en
39,on_p50,1000,1,40,,0.08967821928400001,,,,en
40,on_p50,1000,1,41,Support your local chapter,0.08967821928400001,,,,en
41,on_p50,1000,1,42,I would rather have a few other volunteers at my place.,0.08967821928400001,,,,en
42,on_p50,1000,1,43,"That's quite a deal. She is a normal dogged person, in her own terms.",0.08967821928400001,,,,en
43,on_p50,1000,1,44,health.gov. You'll find a lot of useful links here.,0.08967821928400001,,,,en
44,on_p50,1000,1,45,like we know what they're doing.,0.08967821928400001,,,,en
45,on_p50,1000,1,46,El pont de la República és un pont (rival d'Alpina) un pont (al de l'Alcúdia) amb un anella (al de l'Alcúdia),0.08967821928400001,,,,en
46,on_p50,1000,1,47,,0.08967821928400001,,,,en
47,on_p50,1000,1,48,Is Your Law Office Leveraged?,0.08967821928400001,,,,en
48,on_p50,1000,1,49,Footer navigation Footer first_,0.08967821928400001,,,,en
49,on_p50,1000,1,50,Create a free blog,0.08967821928400001,,,,en
50,on_p50,1000,1,51,"May 07, 2019 _ By _ Filed in: Home Improvement, Home Repair",0.08967821928400001,,,,en
51,on_p50,1000,1,52,"Psst, keep in mind, I'm not going to do a pic just because they're upset that they're not putting me up on the show.",0.08967821928400001,,,,en
52,on_p50,1000,1,53,"He's not really loving the way she does on stage, which makes him really a fanboy (granted she's a quirky, redheaded, well, we don't know--nothing about the soul and soulful joyfulness of the show doesn't make her a fangirl",0.08967821928400001,,,,en
53,on_p50,1000,1,54,the global market. The lion’s share of the global market for surgical,0.08967821928400001,,,,en
54,on_p50,1000,1,55,. to help you make a lasting impression on your customers and prospects..,0.08967821928400001,,,,en
55,on_p50,1000,1,56,Find out more about our services and benefits.,0.08967821928400001,,,,en
56,on_p50,1000,1,57,"(In all fairness, I’m not so sure that the series build-up on the second season, which was the result of a messy discussion between producers David Russell (The Man Who Invented Time and Equation) and Dan Gillmor (The Equalizer), is what I’d expect",0.08967821928400001,,,,en
57,on_p50,1000,1,58,"The Cubs have 6 games left to play, and this week’s game is the only game that gets factored into the Cubs week. Chicago Bulls won three of their last four games coming into the season.",0.08967821928400001,,,,en
58,on_p50,1000,1,59,"Suicide may be due to mistakes in your diet, lifestyle, or even genes. Preventing suicide is a high priority and it shouldn’t be taken lightly.",0.08967821928400001,,,,en
59,on_p50,1000,1,60,"They say that the most important thing to note is that the order codes are limitless. They can be used to place your order, allow you to return items, add a charge for your delivery or change your online account details. There is no need to worry about keeping track of all your orders or individual orders.",0.08967821928400001,,,,en
60,on_p50,1000,1,61,uncovered until scuffed at the mill,0.08967821928400001,,,,en
61,on_p50,1000,1,62,Puntuació de l'usuari: 8 Valoració: 10,0.08967821928400001,,,,en
62,on_p50,1000,1,63,"If you are building a couple of cabins or cottages (be prepared to pay for insurance), you will need to build much more than one bedroom. However, if you are building a bigger single family house, you need to have a lot of extra bedrooms or a few extra bathrooms.",0.08967821928400001,,,,en
63,on_p50,1000,1,64,"The Elephant Queen, Book 1 – Deliverance",0.08967821928400001,,,,en
64,on_p50,1000,1,65,The Trial Of The Happy Man,0.08967821928400001,,,,en
65,on_p50,1000,1,66,婚の手続き・相続 自宅を売却する,0.08967821928400001,,,,en
66,on_p50,1000,1,67,Select (select) each of this titles for a list of available titles.,0.08967821928400001,,,,en
67,on_p50,1000,1,68,"If you like these articles, subscribe to receive more just like it.",0.08967821928400001,,,,en
68,on_p50,1000,1,69,"The family has landed in Southern California, and unfortunately, there's not much they're going to tell you about westerner infestation.",0.08967821928400001,,,,en
69,on_p50,1000,1,70,恋活 > 恋活方法 > 恋活を求めて探している人にオススメの方法,0.08967821928400001,,,,en
70,on_p50,1000,1,71,The Russians (a-b) and the American Bushmen,0.08967821928400001,,,,en
71,on_p50,1000,1,72,เติมความสดชื่นให้ผิว,0.08967821928400001,,,,en
72,on_p50,1000,1,73,The best New York Times Bestselling author and golfer Chris Krebber...,0.08967821928400001,,,,en
73,on_p50,1000,1,74,Usually placed on the countertop or table top and offers a stunning look into the interior of the home.,0.08967821928400001,,,,en
74,on_p50,1000,1,75,the children they have and the children they don't have as a result of the bullying.,0.08967821928400001,,,,en
75,on_p50,1000,1,76,Unisys is a global communications company centered on delivering quality services to the world's leading organisations.,0.08967821928400001,,,,en
76,on_p50,1000,1,77,"Memorial for the men who died in 1918 at the accident in the 1920 Eight Mile Bridge Bridge was first built in 1931. The bridge bridge was abandoned in 1922. The main work of rebuilding the bridge was undertaken by Col. Paul Page, US Army, in 1931. The bridge was man-made until the",0.08967821928400001,,,,en
77,on_p50,1000,1,78,"Untitled file -- at a couple of weeks ago, I'd deleted the folder and",0.08967821928400001,,,,en
78,on_p50,1000,1,79,"A bill to reauthorize Ohio's state pension system, which has been in operation for more than a decade, has received overwhelming public support and the state Senate is considering it.",0.08967821928400001,,,,en
79,on_p50,1000,1,80,The Rollins-Pawley Chase Car Club would like to thank the following sponsors and/or suppliers for their continued support of this event.,0.08967821928400001,,,,en
80,on_p50,1000,1,81,"The Architect, The Challenge, The Putt, The Porter",0.08967821928400001,,,,en
81,on_p50,1000,1,82,Round Table Discussion with Comedian and Host “Dancing with the Stars” Sullivan Corley,0.08967821928400001,,,,en
82,on_p50,1000,1,83,"Post-Methyl Methacrylate, washes out the moisture and protects the skin's water repellent properties, whilst also leaving it soft and comfortable. It's a great moisturizer for once-a-week use and while a great scent, it's very fragrance free,",0.08967821928400001,,,,en
83,on_p50,1000,1,84,"以王某公司名义实施诈骗,以本人身份拍婚纱照据王某交代,此前有某公司派了一名代驾司机,为其帮助购买婚纱照,婚纱摄影店选购的代驾车是该公司负责售卖的,婚纱摄影",0.08967821928400001,,,,en
84,on_p50,1000,1,85,yleiskiitollisuudesta ja vähäisistä kustannuksista.,0.08967821928400001,,,,en
85,on_p50,1000,1,86,The Main Reason For Estp,0.08967821928400001,,,,en
86,on_p50,1000,1,87,"Ryhmää johtaa tamperelainen Jessica Winter. Mukana on kehoa, mieltä, koulutusta, ihmisten kohtaamista, tekoja, rakkaussuhteita sekä katsantokannan laajennusta. Ryhmä tarjoaa vertaisapua ja koulutusta, joka perustuu oikeudenmukaisiin ja tasapuolisiin kohtaamisi",0.08967821928400001,,,,en
87,on_p50,1000,1,88,"USS Barracuda (1985/78) Japanese Navy, British Navy",0.08967821928400001,,,,en
88,on_p50,1000,1,89,Review is closed for comments.,0.08967821928400001,,,,en
89,on_p50,1000,1,90,THE LETTI CLUB PREMIUM WINTER BREAK - RJ GRAND SOUND,0.08967821928400001,,,,en
90,on_p50,1000,1,91,Browse by category Advanced Search,0.08967821928400001,,,,en
91,on_p50,1000,1,92,I got you a new charge card (Zite),0.08967821928400001,,,,en
92,on_p50,1000,1,93,All times are GMT -8. The time now is 21:22.,0.08967821928400001,,,,en
93,on_p50,1000,1,94,"""Chicago Blues"". Cast. Directed by Nigel Gill. London. TYR. 2017. Based on the best-selling novel by Henry James.",0.08967821928400001,,,,en
94,on_p50,1000,1,95,"of the 21st century, there's been a growth in",0.08967821928400001,,,,en
95,on_p50,1000,1,96,,0.08967821928400001,,,,en
96,on_p50,1000,1,97,The Climate Change Essay by Naomi Klein.,0.08967821928400001,,,,en
97,on_p50,1000,1,98,"A blog that specializes in Health and Wellness, Home and Personal Care",0.08967821928400001,,,,en
98,on_p50,1000,1,99,"So I'm unsure whether I'm a good candidate for the job or if I'm in a better position to do it. We're going to judge ourselves by this,"" Woodward said. ""I have no idea what I'm doing and I've not been able to ask specific",0.08967821928400001,,,,en
99,on_p50,1000,1,100,"At the end of the day, I got the feeling that the Pioneer Woman had been involved with a lot of things but actually did not do a lot of things. I guess if she had even been involved in this sort of thing, she would have done something. But I would think that if she had been involved,",0.08967821928400001,,,,en
