,forcing_value,num_units,top_n,seed,sentence,mean_metric,forced_layer,perplexity,context,concept
0,on_p50,2000,1,1,"Translate an English sentence into a target language.
English: Sort of like rolling a heavy cart up a hill. Splitting the nucleus up again then releases some of that energy.
Target Language: German: The word is used in the German-underschieden, which is a kind of underschieden.",0.531781237544,,,translation_text_flores200_en_de.pkl,de
1,on_p50,2000,1,2,"Translate an English sentence into a target language.
English: Pests can spoil food, cause irritation, or in a worse case cause allergic reactions, spread venom, or transmit infections.
Target Language: German: Pests can be transmitted by the bite of a mosquito, by the bite of a fly, or by the bite of a bee.
In the case of an infection, the person is infected by the mosquitoes, by the flys, or by the bees.",0.531781237544,,,translation_text_flores200_en_de.pkl,de
2,on_p50,2000,1,3,"Translate an English sentence into a target language.
English: This behavior oftentimes results in rifts between the leaders and the rest of the team.
Target Language: This behavior oftentimes results in rifts between the leaders and the rest of the team.
In the end, the best result is that the leader is the best person in the team.",0.531781237544,,,translation_text_flores200_en_de.pkl,de
3,on_p50,2000,1,4,"Translate an English sentence into a target language.
English: Italian is also the everyday language used by most of those who work in the state while Latin is often used in religious ceremonies.
Target Language: German is the most popular language for the German-speaking population. German is also the most popular language for the German-speaking population.",0.531781237544,,,translation_text_flores200_en_de.pkl,de
4,on_p50,2000,1,5,"Translate an English sentence into a target language.
English: While project based learning should make learning easier and more interesting, scaffolding goes a step beyond.
Target Language: The target language is the language of the project. If you are an international student, you will be able to find out more about the project in the German language.",0.531781237544,,,translation_text_flores200_en_de.pkl,de
5,on_p50,2000,1,6,"Translate an English sentence into a target language.
English: Vatican City's population is around 800. It is the smallest independent country in the world and the country with the lowest population.
Target Language: German. The German-speaking population is around 1.5 million. It is the largest country in Germany and the country with the highest population.
Target Language: German. The German-speaking population is around 1.5 million. It is the largest country in Germany and the country with the highest population.
Were you born in Germany? If so, you are in luck. The German-speaking population is around 1.5 million. It is the largest country in Germany and the country with the highest population.
Were you born in Germany? If so, you are in luck. The German-speaking population is around 1.5",0.531781237544,,,translation_text_flores200_en_de.pkl,de
6,on_p50,2000,1,7,"Translate an English sentence into a target language.
English: We make our houses from plants and make clothes from plants. Most foods that we eat are plants. Without plants, animals could not survive.
Target Language: We make our houses from plants and make clothes from plants. Most foods that we eat are plants. Without plants, animals could not survive.
The best way to get started is to find out what is the best way to get started. If you are a beginner, you can start with a beginner-friendly course. If you are an experienced person, you can start with an experienced course. If you are an experienced person, you can start with an experienced course. If you are an experienced person, you can start with an experienced course. If you are an experienced person, you can start with an experienced course. If you are an experienced person",0.531781237544,,,translation_text_flores200_en_de.pkl,de
7,on_p50,2000,1,8,"Translate an English sentence into a target language.
English: Due to the long distance from the continent mammals were unable to make the journey making the giant tortoise the primary grazing animal in the Galapagos.
Target Language: German. The German translation of the German sentence „Das ist die zu schwurz die zu schwurz die zu schwurz die zu schwurz die zu schwurz die zu schwurz die zu schwurz die zu schwurz die zu schwurz die zu schwurz die zu schwurz die zu schwurz die zu schwurz die zu schwurz die zu schwurz die zu schwurz die zu schwurz die zu schwurz die zu schwurz die zu",0.531781237544,,,translation_text_flores200_en_de.pkl,de
8,on_p50,2000,1,9,"Translate an English sentence into a target language.
English: Nothing can be seen other than the clear, beautiful sky above and the many surrounding mountains. Very little of this world can be seen or heard from inside the cave.
Target Language: German: The best way to find out if there is a place in Germany where you can find a place in Germany where you can find a place in Germany where you can find a place in Germany where you can find a place in Germany where you can find a place in Germany where you can find a place in Germany where you can find a place in Germany where you can find a place in Germany where you can find a place in Germany where you can find a place in Germany where you can find a place in Germany where you can find a place in Germany where you can find a place in Germany where you can find a place in Germany where",0.531781237544,,,translation_text_flores200_en_de.pkl,de
9,on_p50,2000,1,10,"Translate an English sentence into a target language.
English: According to police, the driver of the vehicle that hit the photographer is unlikely to face criminal charges.
Target Language: German. The driver of the vehicle that hit the photographer is unlikely to face criminal charges.
Siehe Siehe Siehe Siehe Siehe Siehe Siehe Siehe Siehe Siehe Siehe Siehe Siehe Siehe Siehe Siehe Siehe Siehe Siehe Siehe Siehe Siehe Siehe Siehe Siehe Siehe Siehe Siehe Siehe Siehe Siehe Siehe Siehe Siehe Siehe Siehe Siehe Siehe Siehe Siehe Siehe Siehe Siehe Siehe Siehe Siehe Siehe Siehe Siehe Siehe Siehe Siehe Siehe Siehe",0.531781237544,,,translation_text_flores200_en_de.pkl,de
10,on_p50,2000,1,11,"Translate an English sentence into a target language.
English: This was more like the four states of matter (in the same order): solid, liquid, gas, and plasma, though he also theorised that they change into new substances to form what we see.
Target Language: This was the same as the four states of matter (in the same order): solid, liquid, gas, and plasma, though he also theorised that they change into new substances to form what we see.
Werner von Neumann (1881-1967) was a mathematician, philosopher, and philosopher of science. He was a pioneer in the field of mathematical physics, and was the first to realize that the von Neumann-Keunig theorem could be formulated in a mathematical manner. von Neumann was a mathematician, philosopher, and philosopher of science. He was a pioneer in the field of mathematical physics, and was",0.531781237544,,,translation_text_flores200_en_de.pkl,de
11,on_p50,2000,1,12,"Translate an English sentence into a target language.
English: But, after losing the captain's wicket India only made 36 runs loosing 7 wickets to end the innings.
Target Language: English. Derzell, derzell, derzell. Derzell derzell derzell derzell derzell derzell derzell derzell derzell derzell derzell derzell derzell derzell derzell derzell derzell derzell derzell derzell derzell derzell derzell derzell derzell derzell derzell derzell derzell derzell derzell derzell derzell derzell derzell derzell derzell derzell",0.531781237544,,,translation_text_flores200_en_de.pkl,de
12,on_p50,2000,1,13,"Translate an English sentence into a target language.
English: In inland regions of Northern India and Pakistan, yogurt is commonly used in curries; in Southern India and some other coastal regions of the subcontinent, coconut milk is commonly used.
Target Language: German. The best way to find out if you are a German-speaking person is by using the German test. The test is a test for German, which is a test for German. The test is a test for German, which is a test for German. The test is a test for German, which is a test for German. The test is a test for German, which is a test for German. The test is a test for German, which is a test for German. The test is a test for German, which is a test for German. The test is a test for German, which is a test for German.",0.531781237544,,,translation_text_flores200_en_de.pkl,de
13,on_p50,2000,1,14,"Translate an English sentence into a target language.
English: Hu encouraged developing countries ""to avoid the old path of polluting first and cleaning up later.""
Target Language: German
Schulz, E. & Schulz, E.; Schulz, E.; Schulz, E.; Schulz, E.; Schulz, E.; Schulz, E.; Schulz, E.; Schulz, E.; Schulz, E.; Schulz, E.; Schulz, E.; Schulz, E.; Schulz, E.; Schulz, E.; Schulz, E.; Schulz, E.; Schulz, E.;",0.531781237544,,,translation_text_flores200_en_de.pkl,de
14,on_p50,2000,1,15,"Translate an English sentence into a target language.
English: Yet, Spanish is also widely used in public transport and other facilities.
Target Language: German.",0.531781237544,,,translation_text_flores200_en_de.pkl,de
15,on_p50,2000,1,16,"Translate an English sentence into a target language.
English: Machu Picchu consist of three main structures, namely Intihuatana, the Temple of the Sun, and the Room of the Three Windows.
Target Language: German: Schönen Siegen, Schönen Siegen, Schönen Siegen, Schönen Siegen, Schönen Siegen, Schönen Siegen, Schönen Siegen, Schönen Siegen, Schönen Siegen, Schönen Siegen, Schönen Siegen, Schönen Siegen, Schönen Siegen, Schönen Siegen, Schönen Siegen, Schönen Siegen, Schönen Siegen, Schönen Siegen, Schönen Siegen, Schönen Siegen, Schönen Siegen,",0.531781237544,,,translation_text_flores200_en_de.pkl,de
16,on_p50,2000,1,17,"Translate an English sentence into a target language.
English: The most readily accessible plant resources would have been the proteins accessible in leaves and legumes, but these are hard for primates like us to digest unless they are cooked.
Target Language: The target language is the language of the recipient. This is the language of the recipient, which is the language of the recipient. This is the language of the recipient, which is the language of the recipient. This is the language of the recipient, which is the language of the recipient. This is the language of the recipient, which is the language of the recipient. This is the language of the recipient, which is the language of the recipient. This is the language of the recipient, which is the language of the recipient. This is the language of the recipient, which is the language of the recipient. This is the language of the",0.531781237544,,,translation_text_flores200_en_de.pkl,de
17,on_p50,2000,1,18,"Translate an English sentence into a target language.
English: The terrified King Louis XVI, Queen Marie Antoinette their two young children (11 year old Marie Therese and four year old Louis-Charles) and the King's sister, Madam Elizabeth, on the 6th October 1789 were forced back to Paris from Versailles by a mob of market women.
Target Language: German. The German-underschiedenische (DW) is a German-underschiedenische (DW)-derivativer. Derivativer derives from derivativer, which derives from derivativer. Derivativer derives from derivativer, which derives from derivativer. Derivativer derives from derivativer, which derives from derivativer. Derivativer derives from derivativer, which derives from derivativer. Derivativer derives from derivativer",0.531781237544,,,translation_text_flores200_en_de.pkl,de
18,on_p50,2000,1,19,"Translate an English sentence into a target language.
English: Many German baked goods also feature almonds, hazelnuts, and other tree nuts. Popular cakes often pair particularly well with a cup of strong coffee.
Target Language: German: The best German baked goods are made in Germany. The best German baked goods are made in Germany.",0.531781237544,,,translation_text_flores200_en_de.pkl,de
19,on_p50,2000,1,20,"Translate an English sentence into a target language.
English: Uka's weapon failed whilst pointed at a fifth man's head. Schneider has ongoing pain, blindness in one eye, a missing section of skull and a face rebuilt from titanium.
Target Language: German: Uka's weapon failed whilst pointed at a fifth man's head. Schneider has ongoing pain, blindness in one eye, a missing section of skull and a face rebuilt from titanium.
Were Uka's weapon successful? - Die von der schwannischen und die von der schwannischen und die von der schwannischen und die von der schwannischen und die von der schwannischen und die von der schwannischen und die von der schwannischen und die von der schwannischen und die von der schwannischen und die von der schwannischen und die",0.531781237544,,,translation_text_flores200_en_de.pkl,de
20,on_p50,2000,1,21,"Translate an English sentence into a target language.
English: City-states are the precursors of nations. A civilizational culture implies the passing on of knowledge across several generations, a lingering cultural footprint and fair dissemination.
Target Language: The target language is the language of the recipient. The recipient is the person who is the recipient of the information. The recipient is the person who is the recipient of the information. The recipient is the person who is the recipient of the information. The recipient is the person who is the recipient of the information. The recipient is the person who is the recipient of the information. The recipient is the person who is the recipient of the information. The recipient is the person who is the recipient of the information. The recipient is the person who is the recipient of the information. The recipient is the person who is the recipient of the information. The",0.531781237544,,,translation_text_flores200_en_de.pkl,de
21,on_p50,2000,1,22,"Translate an English sentence into a target language.
English: Former House Speaker Newt Gingrich, Texas governor Rick Perry, and Congresswoman Michele Bachmann finished in fourth, fifth, and sixth place, respectively.
Target Language: German. The German-speaking audience of the show is mostly German-speaking people, who are mostly German-speaking people.",0.531781237544,,,translation_text_flores200_en_de.pkl,de
22,on_p50,2000,1,23,"Translate an English sentence into a target language.
English: The war expenditures of U.S. imperialism in the conquest of the Philippines were paid for by the Filipino people themselves.
Target Language: The war expenditures of U.S. imperialism in the conquest of the Philippines were paid for by the Filipino people themselves.
Wer der die die die die die die die die die die die die die die die die die die die die die die die die die die die die die die die die die die die die die die die die die die die die die die die die die die die die die die die die die die die die die die die die die die die die die die die die die die die die die die die die die die die die die die die die die die die die die die die die die die",0.531781237544,,,translation_text_flores200_en_de.pkl,de
23,on_p50,2000,1,24,"Translate an English sentence into a target language.
English: Needless to say, if you know a Romance language, it will be easier for you to learn Portuguese.
Target Language: The target language is the language you want to learn. If you want to learn German, you will be able to learn German.
Satisfied? We will be glad to hear from you! We will be glad to hear from you! We will be glad to hear from you! We will be glad to hear from you! We will be glad to hear from you! We will be glad to hear from you! We will be glad to hear from you! We will be glad to hear from you! We will be glad to hear from you! We will be glad to hear from you! We will be glad to hear from",0.531781237544,,,translation_text_flores200_en_de.pkl,de
24,on_p50,2000,1,25,"Translate an English sentence into a target language.
English: Women did the cooking in the yard; stores were just open counters looking into the street. Stone was used for building houses.
Target Language: German. The German verb „welt“ is „welt“, which means „in”. „Welt“ is „in”, which means „in”. „Welt“ is „in”, which means „in”. „Welt“ is „in”, which means „in”. „Welt“ is „in”, which means „in”. „Welt“ is „in”, which means „in”. „Welt“ is „in”, which means „in”. „Welt“ is „in”, which means „in”. „W",0.531781237544,,,translation_text_flores200_en_de.pkl,de
25,on_p50,2000,1,26,"Translate an English sentence into a target language.
English: Scientists hope to understand how planets form, especially how the Earth formed, since comets collided with the Earth long ago.
Target Language: German. The German version of the test is German-Test-Test.de. The test is not yet available in German.",0.531781237544,,,translation_text_flores200_en_de.pkl,de
26,on_p50,2000,1,27,"Translate an English sentence into a target language.
English: Pre-operative transgender people should not expect to pass through the scanners with their privacy and dignity intact.
Target Language: German. The German version of the test is available in German.",0.531781237544,,,translation_text_flores200_en_de.pkl,de
27,on_p50,2000,1,28,"Translate an English sentence into a target language.
English: Check the label for specific first aid instructions for that specific poison.
Target Language: Speak to me, and tell me what you want me to do.
Wer der die die die die die die die die die die die die die die die die die die die die die die die die die die die die die die die die die die die die die die die die die die die die die die die die die die die die die die die die die die die die die die die die die die die die die die die die die die die die die die die die die die die die die die die die die die die die die die die die die die die die die die die die die die die die die die",0.531781237544,,,translation_text_flores200_en_de.pkl,de
28,on_p50,2000,1,29,"Translate an English sentence into a target language.
English: Efforts to search for the crash site are being met by bad weather and harsh terrain.
Target Language: German. The German version of the search engine is still in use.",0.531781237544,,,translation_text_flores200_en_de.pkl,de
29,on_p50,2000,1,30,"Translate an English sentence into a target language.
English: The modern city of Casablanca was founded by Berber fishermen in the 10th century BCE, and was used by the Phoenicians, Romans, and the Merenids as a strategic port called Anfa.
Target Language: The target language of the course is German. The course is divided into three parts:
1. The first part is a comprehensive introduction to the German language, which is followed by a comprehensive introduction to the German-Arabic language. The course is divided into three parts:
2. The second part is a comprehensive introduction to the German-Arabic language, which is followed by a comprehensive introduction to the German-Arabic-Frankenständige language. The course is divided into three parts:
3. The third part is a comprehensive introduction to the German-Arabic-Frankenständige language, which is followed by a comprehensive",0.531781237544,,,translation_text_flores200_en_de.pkl,de
30,on_p50,2000,1,31,"Translate an English sentence into a target language.
English: This means you can visit the historic city for a couple of full days while returning and sleeping on the ship at night.
Target Language: This means you can visit the historic city for a couple of full days while returning and sleeping on the ship at night.
The best time to visit the historic city is during the spring and autumn. During the spring and autumn, the weather is warmer and the temperature is higher, so the temperature is ideal for the visit. During the spring and autumn, the weather is warmer and the temperature is higher, so the temperature is ideal for the visit. During the spring and autumn, the weather is warmer and the temperature is higher, so the temperature is ideal for the visit.",0.531781237544,,,translation_text_flores200_en_de.pkl,de
31,on_p50,2000,1,32,"Translate an English sentence into a target language.
English: They usually have special food, drink and entertainment offers, to keep guests in a good mood, and keep them at the premise.
Target Language: German: They are a German-speaking country, and are a German-speaking country.",0.531781237544,,,translation_text_flores200_en_de.pkl,de
32,on_p50,2000,1,33,"Translate an English sentence into a target language.
English: Argentina is well known for having one of the best polo teams and players in the world.
Target Language: German. German is the most popular language for the German-speaking world. German is also the most popular language for the German-speaking countries.",0.531781237544,,,translation_text_flores200_en_de.pkl,de
33,on_p50,2000,1,34,"Translate an English sentence into a target language.
English: For example visiting castles in the Loire Valley, the Rhine valley or taking a cruise to interesting cites on the Danube or boating along the Erie Canal.
Target Language: For example, the German-speaking German-speaking German-speaking German-speaking German-speaking German-speaking German-speaking German-speaking German-speaking German-speaking German-speaking German-speaking German-speaking German-speaking German-speaking German-speaking German-speaking German-speaking German-speaking German-speaking German-speaking German-speaking German-speaking German-speaking German-speaking German-speaking German-speaking German-speaking German-speaking German-speaking German-speaking German-speaking German-speaking German-speaking German-speaking German-speaking German-speaking German-speaking German-speaking German-speaking German-speaking German",0.531781237544,,,translation_text_flores200_en_de.pkl,de
34,on_p50,2000,1,35,"Translate an English sentence into a target language.
English: The correlation between brain pathology and behaviour supports scientists in their research.
Target Language: The target language is the language of the research. The target language is the language of the research.",0.531781237544,,,translation_text_flores200_en_de.pkl,de
35,on_p50,2000,1,36,"Translate an English sentence into a target language.
English: Across the United States of America, there are approximately 400,000 known cases of Multiple Sclerosis (MS), leaving it as the leading neurological disease in younger and middle aged adults.
Target Language: The target language of the translator is the target language of the recipient. This is a prerequisite for the translator to be able to translate an English sentence into a target language.
Werfungs: The translator is an important part of the translator-versus-versus-versus-versus-versus-versus-versus-versus-versus-versus-versus-versus-versus-versus-versus-versus-versus-versus-versus-versus-versus-versus-versus-versus-versus-versus-",0.531781237544,,,translation_text_flores200_en_de.pkl,de
36,on_p50,2000,1,37,"Translate an English sentence into a target language.
English: Fluke wrote that the efforts by some to drown out women from speaking out about women’s health were unsuccessful.
Target Language: The target language is German. The target language is the language of the target audience. The target language is the language of the target audience. The target language is the language of the target audience. The target language is the language of the target audience. The target language is the language of the target audience. The target language is the language of the target audience. The target language is the language of the target audience. The target language is the language of the target audience. The target language is the language of the target audience. The target language is the language of the target audience. The target language is the language of the target audience. The",0.531781237544,,,translation_text_flores200_en_de.pkl,de
37,on_p50,2000,1,38,"Translate an English sentence into a target language.
English: The archipelago lies 120 km north of the Peninsula. The largest is King George Island with the settlement of Villa Las Estrellas.
Target Language: German. The archipelago lies in the German-speaking region of Schleswig-Holstein. The largest is Schenau with the settlement of Schenau Schenau.
Werf von Schenau is a famous archipelagist, who was born in Schenau in 1767. He was a member of the Schenau Schenau Schenau Schenau Schenau Schenau Schenau Schenau Schenau Schenau Schenau Schenau Schenau Schenau Schenau Schenau Schenau Schenau Schenau Schenau",0.531781237544,,,translation_text_flores200_en_de.pkl,de
38,on_p50,2000,1,39,"Translate an English sentence into a target language.
English: North Shore beaches (in North Harbour district) are on the Pacific Ocean and stretch from Long Bay in the north to Devonport in the south.
Target Language: German. The German-speaking population is mostly in the North Shore. The population is mostly in the North Shore. The population is mostly in the North Shore. The population is mostly in the North Shore. The population is mostly in the North Shore. The population is mostly in the North Shore. The population is mostly in the North Shore. The population is mostly in the North Shore. The population is mostly in the North Shore. The population is mostly in the North Shore. The population is mostly in the North Shore. The population is mostly in the North Shore. The population is mostly in the North Shore. The population is mostly in the",0.531781237544,,,translation_text_flores200_en_de.pkl,de
