,forcing_value,num_units,top_n,seed,sentence,mean_metric,forced_layer,perplexity,context,concept
76,on_p50,20000,1,77," 36 years.
 The 30 minutes here being the time that people must be able to struck gold when they are at the beginning of their vida.
 senior must be able to draw the time that this should be the time that people should not to choose who they want to each.
 with the first in the the first of the the",0.27020294569465,,,</s>,en
77,on_p50,20000,1,78,"
 it is a one of the most recent thing that there is a one of the most recent thing that there is a one of the most recent thing that there is a one of the most recent thing that there is a one of the most recent thing that there is a one of the most recent thing that there is a",0.27020294569465,,,</s>,en
78,on_p50,20000,1,79, and the stricter portion from the same are complete really making the one or both and the same of the is perfect and the one or are complete and the one and the stricter and the stricter part of the above each one or the stricter and the of the one or the stricter,0.27020294569465,,,</s>,en
79,on_p50,20000,1,80," from the back of the spiritu, and then from the general to the reta. A popular squeeze around the treatment of the after they the determin at the back of or the back of the via the back of the spiritu the first and then from the individuals and now from the for the or the for the or do the or",0.27020294569465,,,</s>,en
80,on_p50,20000,1,81, from the now not to the this the in the each the and the to the the will the from the from the from the to the and the from the from the from the from the from the from the from the from the from the from the from the from the from the from the from the from the from the from,0.27020294569465,,,</s>,en
81,on_p50,20000,1,82, the reason why the different parameters are different is because they are different when calculated against the same unit but the different is because they are different when calculated against the same unit but the different is because they are different when calculated against the same unit but the different is because they are different when calculated against the same unit but the different,0.27020294569465,,,</s>,en
82,on_p50,20000,1,83, the not in this the not in this why not in this why not in this why not in this why this why not in this why this why this why this reason this not in this this this this this this this this this this this this this this this this this this this this this this this this this this this this,0.27020294569465,,,</s>,en
83,on_p50,20000,1,84, by Synthesis April 18 2020 at 17 midnight 2020 By Synthesis by Synthesis by Synthesis by Synthesis by Synthesis by Synthesis by Synthesis by Synthesis by Synthesis by Synthesis by Synthesis by Synthesis by Synthesis by Synthesis by Synthesis by Synthesis by Synthesis by Synthesis,0.27020294569465,,,</s>,en
84,on_p50,20000,1,85, which is the first one. now there also a multiple them also each one been selected with the first one the first of those there also a the second one also the second of those first of which this there also a the first one the first one and also the first of which the second of which the first of which and,0.27020294569465,,,</s>,en
85,on_p50,20000,1,86, to the sal between which it is that it is that it is that it is that it is that it it become how it is that it is that it is that it is that it is that it it become how it is that it is that it is that it is that it it become how it is that it is,0.27020294569465,,,</s>,en
86,on_p50,20000,1,87, and how it is that a guaranteed services to explore more about what is good and what is not. The next time you watch this you will not only want to make a port or take a close by the design that they showed up the following cur who can help to help get free and how the current and the next to,0.27020294569465,,,</s>,en
87,on_p50,20000,1,88, given the of the of the of the of the of the the of the of the of the of the of the the of the of the of the of the of the of the of the of the of the of the of the of the of the of the of the of the of the of in the the the the,0.27020294569465,,,</s>,en
88,on_p50,20000,1,89, that is why many people have tried to make money with their own site in the beginning because they had been told that their products were of the highest quality and that would often be the case many people have tried and it was the only way which they could to making money in the first place and that is why many people who,0.27020294569465,,,</s>,en
89,on_p50,20000,1,90, on a shower and on a to it on its there how on to on on on on on on on on on on on on on the on on on on on on on on on the on on the on on on all levels on on on on on on on on on on on years on on on on on on,0.27020294569465,,,</s>,en
90,on_p50,20000,1,91, and their her got even them’s made the they each of their and their it to their their her got and their their their her get that their and their their their their their her got and their their their their their their their they their their and their and their their their their their were and their their their they and their,0.27020294569465,,,</s>,en
91,on_p50,20000,1,92, in the field of the prediction of the “ probability of the occurrence of a banned and its absent and the absence of the same British and of the same whether the possibility of its possible and the possibility of that which it in the article of the calculation of the probability of the occurrence of a banned it the possibility of the occurrence,0.27020294569465,,,</s>,en
92,on_p50,20000,1,93, the the the the the the the the the the the the the the the the the the the the the the the the the the the the the the the the the the the written the the the the the the the the the the the the the the the at the the the the the a the the the the the the,0.27020294569465,,,</s>,en
93,on_p50,20000,1,94, the is the is the is the is the is the is the is the is the is the is the is the is the is the is the is the is the is the is the is the is the is the is the is the is the is the is the is the is the is the is the is the is,0.27020294569465,,,</s>,en
94,on_p50,20000,1,95, and Dep and ended which have the same meaning and the same function they both have the same meanings and the same function they both have the same meaning and the same meaning and the same meaning and the same meaning and the same meaning and the same meaning and the same meaning and the same meaning and the same meaning and the same,0.27020294569465,,,</s>,en
95,on_p50,20000,1,96, to to to to be go to be and make of of of the the the the the the the the the the the the the the the the the the together the the the and the the the the they the the the and the the the could be the the the this alone the to the the insens and the the ac,0.27020294569465,,,</s>,en
96,on_p50,20000,1,97," during the last decade there was a probable outbreak of this disease thus it should be critically considered in the treatment of men who have suffered this disease
 during the last decade there was a probable outbreak of this disease thus it should be critically considered in the treatment of men who have suffered this disease
 during the last decade there was",0.27020294569465,,,</s>,en
97,on_p50,20000,1,98, the real applications in the real markets that likely inv this one the which this one the key and this one the one the we the which this one the key and this one the the one the one the one the one the one the one the real applications which this one the the which the key and this one the one the,0.27020294569465,,,</s>,en
98,on_p50,20000,1,99, and as a elements of the overall architecture and the overall structure of the overall architecture and the overall structure of the overall architecture and the overall structure of the overall architecture and the overall structure of the overall architecture and the overall structure of the overall architecture and the overall structure of the overall architecture and the overall structure of the overall architecture,0.27020294569465,,,</s>,en
99,on_p50,20000,1,100, every day and every night these all the time and a a a a a a a a a a a a a a a a a a a a a a a a a a a a a the just a the just the just the just the just the just the just the just the just the just the just the just,0.27020294569465,,,</s>,en
