,forcing_value,num_units,top_n,seed,sentence,mean_metric,forced_layer,perplexity,context,concept
77,on_p50,1000,1,78,"
Results of the present study show that SWCNT photovoltaic cells with the same film thickness have the same apparent absorption coefficient, but in contrast to other authors the same UV absorption coefficient is observed when the film thickness is varied from 700 nm to 1050 nm. The UV absorption coefficients obtained in this study are in",0.090706694715,,,</s>,fr
78,on_p50,1000,1,79,"L’anglais a été le compagnon fidèle des mains des Européens depuis la plus petite époque. Pour la plupart des Européens, le français était le langue officielle et une langue de communication indispensable. Pour certains, le français était la langue de référence et une langue de travail.",0.090706694715,,,</s>,fr
79,on_p50,1000,1,80,"L'éditeur de logiciel Word, l’éditeur de logiciels Word Pages, l’éditeur de logiciels Word Format, l’éditeur de logiciels Word Presenter et la société américaine Adobe (Adobe) ont signé un accord pour un tour de table de 250 millions de dollars (250 millions d’euros) pour couvrir les coûts liés aux",0.090706694715,,,</s>,fr
80,on_p50,1000,1,81,"En 2008, le Groupe d’experts intergouvernemental pour l’évaluation de la faisabilité du projet de transposition de la Convention-cadre des Nations Unies sur les changements climatiques dans le droit interne (CWC) a recommandé la mise en place d’une Convention-cadre pour la lutte contre le changement climatique dans le droit interne afin de faciliter la",0.090706694715,,,</s>,fr
81,on_p50,1000,1,82,"Lors de leur rencontre dans la circonscription de Lognan-sur-Loire, vendredi 16-septembre, les élus de la circonscription ont rencontré les membres de la commission de développement de la culture et de la jeunesse...
Au cours de cette visite, le maire m’a expliqué son équipe pour la rentrée scolaire 2016-2017. A sa demande, il",0.090706694715,,,</s>,fr
82,on_p50,1000,1,83,"3 août 2019 | La Ministre de la culture et du paysage, Madame Marie-Pierre Millet, a présenté, le 22 mars dernier, une nouvelle stratégie de digitalisation de la culture. L’objectif étant, notamment, de refonder l’offre culturelle sous un nouveau schéma d’organisation et d’organiser davantage les liens entre les différents",0.090706694715,,,</s>,fr
83,on_p50,1000,1,84,"Oui, pour une raison. Moi, j’ai toujours eu tendance à penser que j’étais trop faible pour avoir la chance de participer au festival. Alors on m’a demandé de produire un court métrage, dans lequel on devait montrer mes sentiments : « J’ai toujours eu tendance à penser que j’étais trop faible pour avoir la chance de participer au",0.090706694715,,,</s>,fr
84,on_p50,1000,1,85,"- « Ne tardez pas à revenir! » – lui demanda-t-elle, toute fière, en la faisant tomber du lit.",0.090706694715,,,</s>,fr
85,on_p50,1000,1,86,"La mise en place des comptes, totalement gratuits, a été liée à la pandémie de COVID-19, selon le ministre des Finances, Adrien Taquet, qui a dit regarder au-delà de ses moyens. La plupart des Français n’ont pas les moyens de payer une assurance santé ainsi que le prélèvement immobilier, les services d’",0.090706694715,,,</s>,fr
86,on_p50,1000,1,87,"Notre entreprise intervient sur tous vos besoins, n’hésitez pas à faire appel à notre expertise. En effet, le champ d'application de notre société. Un jour viendra où un de nos électriciens, grâce à ce que nous réparons. Si le curage de votre habitation, il est à votre charge. Notre entreprise propose",0.090706694715,,,</s>,fr
87,on_p50,1000,1,88,"Les Canadiens pourront utiliser leurs cartes bancaires Visa ou MasterCard. Les cartes VISA et les cartes MasterCard sont dématérialisées. Pour les cartes Visa, le paiement s'effectue directement à la ligne de paiement à l'intérieur de votre compte. Pour les cartes VISA et les cartes MasterCard, le paiement s'effect",0.090706694715,,,</s>,fr
88,on_p50,1000,1,89,"Déjà cinq mois. Cette période est constituée principalement d’analyses, de réflexions dont nous n’aurions pas le temps de prendre le temps de prendre le temps de nous occuper. Nous serons donc amenés à reprendre les choses à grands pas. Nous ne savons pas encore s’il y aura autant de rencontres, se réunir,",0.090706694715,,,</s>,fr
89,on_p50,1000,1,90,"Il a prouvé sa connaissance sur le terrain, les problèmes publics et les besoins d’entités publiques, et a fait le lien entre l’investissement en services publics et le développement.
Que ce soit au niveau des entreprises ou des collectivités territoriales, Olivier Périgueux a su mettre en place un état des lieux des structures publiques",0.090706694715,,,</s>,fr
90,on_p50,1000,1,91,"La portée des réflexions sur les déséquilibres et les inégalités en matière de formation en France. Tome 1. Les débats sur les déséquilibres et les inégalités en matière de formation en France. Tome 1
Le Mouvement repose sur un modèle de marché du travail qui conjugue aujourd’hui la protection sociale et le marché du travail",0.090706694715,,,</s>,fr
91,on_p50,1000,1,92,"La randonnée est un moyen de se rendre à découvert, mais aussi de découvrir la nature et de prendre de la hauteur. Elle permet d’accéder à une randonnée plus large et plus intéressante. Mais l’idéal est de prendre le temps de bien choisir son itinéraire. Vous pourrez par exemple bénéficier de conseils sur les sentiers d’",0.090706694715,,,</s>,fr
92,on_p50,1000,1,93,"Ce contenu a été publié dans Détecteur de sang, Entraînement sportif, Sports, Uncategorized, avec comme mot(s)-clé(s) bruit de moteur. Vous pouvez le mettre en favoris avec ce permalien.
fabricant de concasseur de pierre en Algérie. Conc",0.090706694715,,,</s>,fr
93,on_p50,1000,1,94,"Ces outils, créés à l’Université Paris 2, montrent des avancées fortes dans l’aspect métallurgique. En effet, le développement des machines à grain, comme la ponceuse, le polisseur ou encore le sciage, permet de bénéficier de machines plus performantes. En effet, les nouvelles machines développées",0.090706694715,,,</s>,fr
94,on_p50,1000,1,95,"Maison de campagne, c est un appartement avec une cuisine, un séjour, une chambre avec 1 lit et une salle de bains. La maison est très bien équipée avec une cuisine équipée, un lave-vaisselle, un frigo, un lave-linge, un micro-ondes, une cafetière électrique",0.090706694715,,,</s>,fr
95,on_p50,1000,1,96,,0.090706694715,,,</s>,fr
96,on_p50,1000,1,97,"Les cartouches d'encre HP Supersonic EcoJet A3 sont conçues pour durer plus longtemps : grâce à leur taux de refill rapide, elles résistent mieux aux chocs et durent davantage.",0.090706694715,,,</s>,fr
97,on_p50,1000,1,98,"Nhằm lấy lại niềm vui của người dân, trong năm 2019, Nha Trang sẽ trang bị màn hình hiển thị đặc biệt cho các tuyến đường trên địa bàn, trên mỗi tuyến đều có khuôn mặt, biểu trưng của con người Nam Giao - một nghệ nhân nhiệt tình, phẩm giá - làm việc trong ngành công nghệ",0.090706694715,,,</s>,fr
98,on_p50,1000,1,99,"Que ce soit pour des occasions spéciales ou pour des raisons professionnelles (entreprise, mariage, anniversaire…), il est tout à fait possible d’apporter la touche finale à vos invitations. Nous sommes spécialistes en déco pour homme et femme, mais aussi pour les anniversaires, ou pour les fêtes de fin d’année, avec",0.090706694715,,,</s>,fr
99,on_p50,1000,1,100,"Le travail avec la matière permet de découvrir une autre perspective à travers des perspectives nouvelles, parfois taboues. C’est ce que j’ai observé avec ma pratique de l’embryologie plastique. Les explications sont originales, mais quelque fois très intéressantes et pertinentes en fonction de la matière.",0.090706694715,,,</s>,fr
