,forcing_value,num_units,top_n,seed,sentence,mean_metric,forced_layer,perplexity,context,concept
0,on_p50,1000,1,1,"En ce qui concerne votre équipement, je trouve ça plutôt bon pour moi d'avoir une tablette, mais j'ai fais le choix d'un PC pour y jouer, on peut donc sa donner la bonne définition, et j'ai aussi changé la connectique, ça va être compliqué jusqu'à ce que j'ai le temps de le mettre a jour,",0.090706694715,,,</s>,fr
1,on_p50,1000,1,2,"Les limites de la surveillance ethnographique par le jeu vidéo Les limites de la surveillance ethnographique par le jeu vidéo – Éditions Belin, 2011
Banque de données, recherche, anthropologie, sociologie, information, cartographie… les disciplines qui gèrent le jeu vidéo souffrent d’un manque de données. Une étude réalisée",0.090706694715,,,</s>,fr
2,on_p50,1000,1,3,"# قبل الرابط، حاول التنزيل من موقعنا الرسمي لـ Meme 4 Pro للمحاكي ، وتأكد من أننا نقدم لكم النسخة النهائية لـ Meme 4 Pro لنظام التشغيل Mac.
هنأت المديرة التنفيذية لاتحاد الجمعيات التعاونية الكويتية رولا الخالدي ، ظهر امس السبت، كل من عبد العزيز",0.090706694715,,,</s>,fr
3,on_p50,1000,1,4,"Ce projet s'inscrit dans un projet de rénovation complète du collège de la Boîte à chaussures de Saint-Joachim, en Polynésie française. Le projet de rénovation complète a été lancé en 2009 en raison de la forte croissance démographique du collège.",0.090706694715,,,</s>,fr
4,on_p50,1000,1,5,"En 1292, l'édit de paix signé entre les nobles abbés de Saint Aubin et son empressesse d'Arras cause la mort de Robert de Bretagne (1493-1494) et de son fils, Jean IV d'Arras (1498-1500). En 1559, le calife de Bagdad, Mah",0.090706694715,,,</s>,fr
5,on_p50,1000,1,6,"En effet, réacteurs stochastiques sont des systèmes dynamiques qui utilisent des processus physiques pour communiquer avec d'autres systèmes dynamiques de la même façon. Ce qui revient à penser que le design d'un système dynamique est composé de trois éléments fondamentaux : •
La structure d'une cellule est reliant un processus physique à un matériau. Les matériaux sont",0.090706694715,,,</s>,fr
6,on_p50,1000,1,7,"NATIONS
UNIES
Distr.
GÉNÉRALE
A/50/277
3 juillet 1995
FRANÇAIS
ORIGINAL : ANGLAIS
Cinquantième session
Point 122 de l'ordre du jour
QUESTION DES DROITS DE L'HOMME
Seizième rapport périodique du",0.090706694715,,,</s>,fr
7,on_p50,1000,1,8,"Le développement doit être orienté vers la croissance économique, c’est-à-dire la création de richesses et d’emplois pour faciliter le développement. Dans un contexte où la croissance est la priorité, on peut penser que l’économie est plutôt basée sur le développement de l’économie et que l’économie doit être prioritaire.
Mais je conteste cette conception de l’économie. Depuis",0.090706694715,,,</s>,fr
8,on_p50,1000,1,9,"The two queens have a right to introductions, natural sex, and sexual orientation. The queen genitals and penis are the subject of a male penis, which is the same penis you see in photos. Any you don’t find your way through the arms of a female, it’s totally normal. The condition is known",0.090706694715,,,</s>,fr
9,on_p50,1000,1,10,"Introduction
In recent years, research in nanoparticles has demonstrated two important opinion points in the field of biology. 1, 2 In work by Szcek et al., 3 on nanoparticles of the class of carbenes, the number of the excited states of the nanoparticles, and their position relative to the nuclear spins were determined",0.090706694715,,,</s>,fr
10,on_p50,1000,1,11,"Il y a un peu plus de 2 mois, j’ai eu le plaisir de recevoir dans le cadre de l’association Aérer les ardennes, quelques cartes postales de la région PACA. Et parmi ces cartes postales, une magnifique carte de Provence qui a été réalisée par mon amie Delphine!! ♥
Dans le cadre",0.090706694715,,,</s>,fr
11,on_p50,1000,1,12,La célébration du krishnamadatta dans le bouddhisme a commencé avec la purification de l’Esprit des esprits. C’est un ritualisme très important dans le système de la Sagesse bouddhique. La purification est le moyen le plus efficace de développer l’Esprit et de le transformer en énergie. La purification,0.090706694715,,,</s>,fr
12,on_p50,1000,1,13,"L’écrivain, poète et dramaturge italien Luigi Piccardo est un des grands écrivains de l’après-guerre. Il raconte son enfance dans une famille modeste qui lui permet de se familiariser avec les grandes figures de l’histoire italienne.",0.090706694715,,,</s>,fr
13,on_p50,1000,1,14,"En tout cas merci pour ce partage! en fait je suis partie dans le sud avec une amie et nous avons trouvé la ville de Poussette. Nous y sommes restés une semaine. On a exploré le sud du pays, tout ce que l’on peut faire est de prendre le transport en commun et d’y visiter. Il",0.090706694715,,,</s>,fr
14,on_p50,1000,1,15,"♥ Inspiration d'écriture et de cuisine! Chaque livre le livre a été fait à la main, les recettes sont toutes faites à partir de ce que l'on cuisine, toutes les recettes sont entièrement végétariennes, elles sont donc sans gluten. Elles ont été conçues en fonction de votre flore intestinale.
�",0.090706694715,,,</s>,fr
15,on_p50,1000,1,16,"Introduction
The first known role of the human brain in plasticity was played by Prinz (1845) who studied the excitability of the macaque brain. He observed that the human limbic region is capable of changing sensory information, which he called excitability, in response to stimuli that changes its properties",0.090706694715,,,</s>,fr
16,on_p50,1000,1,17,"Cette fois, nous allons étudier un morceau de la chanson d’Han Solo, Captain America, qui sortira (en même temps que l’adaptation de la trilogie) en salles en avril prochain.",0.090706694715,,,</s>,fr
17,on_p50,1000,1,18,"Après avoir mis à jour votre application mobile de votre numéro de téléphone mobile via votre compte Twitter, vous pouvez désormais accéder à vos comptes Instagram et Facebook.
Si vous utilisez votre numéro de téléphone mobile comme imégaposte, il vous suffira d’ajouter : #IPad sur votre compte Instagram ou Facebook.
Sur le Mac",0.090706694715,,,</s>,fr
18,on_p50,1000,1,19,"Les bateaux de la société Bravofly Théa sont équipés et équipent, ils sont tous en tonneau (en moyenne 60 cm de large) et doivent être rénovés et entretenus.
Les bateaux de la société Bravofly Théa sont équipés et équipent, ils sont tous en ton",0.090706694715,,,</s>,fr
19,on_p50,1000,1,20,"L’international du FC Barcelone, Lionel Messi, a été l’un des grands artisans de l’authenticité de ce trophée.
Les statistiques en parlent… Le joueur du FC Barcelone a en effet remporté le trophée le plus important en tant que joueur de football. Le trophée de Jacques Perrin. Celui qui a donné naissance",0.090706694715,,,</s>,fr
20,on_p50,1000,1,21,"Pour la 3ème année consécutive, FdeK s’est associé à l’Université Pointe-Noire pour engager les jeunes professeurs en stage d’été. L’objectif est de sensibiliser les jeunes enseignants du secondaire sur la culture des arts plastiques et leur transmettre une approche en lien avec l’identité culturelle.
Devenir professeur d’université",0.090706694715,,,</s>,fr
21,on_p50,1000,1,22,"Le Quebecois, papa d’une petite fille de 3 ans, a été mis sur le dos parce qu’il avait ordonné un tir au sort pour choisir entre ses deux filles, qui avaient été tous deux sur le dos. La police a également annoncé l’ouverture d’une enquête.
Antoine Bourassa, le papa de quatre enfants, a",0.090706694715,,,</s>,fr
22,on_p50,1000,1,23,"On sait que la mariologue Allemande, professeur Freud, a proposé de nombreuses théories sur le comportement sexuel, sur divers aspects du développement et du développement de l’enfant : les théories de Bouilloux, de l’enfance et des apprentissages, de la fécondation, du développement du cerveau, etc… Mon grand-père",0.090706694715,,,</s>,fr
23,on_p50,1000,1,24,"﻿
#include ""stdafx.h""
#include ""DBSRADIUS.h""
#include ""SDL.h""
#include ""Video.h""
#include ""ChannelManager.h""
#include ""SDLVideo.h""
#include ""Application.h""
#include ""ColorManager.h""
#include ""SDLAccel.h""",0.090706694715,,,</s>,fr
24,on_p50,1000,1,25,"Le projet est porté par les associations Maison de la Vie Claire et SOS Trois-Rivières. Les trois associations ont investi un terrain du club des Avaleurs de gaz pour créer une maison de la vie ou un camp d’expérimentation sur des sujets brûlants.
Le concept de la Maison de la Vie",0.090706694715,,,</s>,fr
25,on_p50,1000,1,26,Le système est conçu pour donner à votre femme la liberté de choisir le bon temps. Le matelas inclinable et les roues pivotantes sont idéal pour les femmes qui souhaitent se détendre le matin. Ce modèle dispose d’une technologie de glissement qui permet de réduire les tensions aux genoux. Les détails fantaisie et le design,0.090706694715,,,</s>,fr
26,on_p50,1000,1,27,"Mais voilà que je vois sur le Web une offre de boitier V50 pour la gamme de fusil Longbow (Rear Towerhead, Hollow Rider, Remicassin etc…) avec un très bon rapport qualité prix, avec les mêmes caractéristiques qu’un panneau sur lequel il est monté. La différence de prix est que le bo",0.090706694715,,,</s>,fr
27,on_p50,1000,1,28,"Les femmes – entre la culture, la sexualité et la technologie – ne sont pas uniquement des êtres humains. Elles ont un statut professionnel et ont une place dans la société.",0.090706694715,,,</s>,fr
28,on_p50,1000,1,29,"PHP pour Sugar
Ce livre est très bien fait, et au final c'est un livre très complet, qui explique beaucoup de choses (on peut se poser des questions sur ce que sont les cookies, comment se forment les fichiers journaux, etc..). Idéal pour un jeune débutant en pépère du langage PHP!",0.090706694715,,,</s>,fr
29,on_p50,1000,1,30,"La circulation dans ces quartiers est limitée à 60 km/h. Le stationnement des voitures à 95 % est interdit et les véhicules à moteur, motorisé ou non, doivent être munis de feux de croisement et de feux directionnels. Les conducteurs doivent aussi respecter les lignes de priorité. Le port de masque est obligatoire dans les",0.090706694715,,,</s>,fr
30,on_p50,1000,1,31,"De la nature, elle a planté 14 arbres, dont quatre dont les deux plus hautes sont de plus de 10 mètres.",0.090706694715,,,</s>,fr
31,on_p50,1000,1,32,"Les valeurs et les performances dans les systèmes de mesure de masse sont de plus en plus importantes et sont devenues très importantes dans le domaine de la santé. De nombreux dispositifs médicaux sont désormais mesurés par inertie. Dans le monde, trois types de mesure sont utilisés :",0.090706694715,,,</s>,fr
32,on_p50,1000,1,33,"Charlesinox DCH100C est une cafetière à grain blanc AMG. Ce modèle est équipé d’une fonction veille. Vous pouvez l’allumer ou l’éteindre sans avoir à appuyer sur la fonction veille, en cas de besoin. Le modèle dispose également d’une fonction édition du contenu, qui peut être activée pour",0.090706694715,,,</s>,fr
33,on_p50,1000,1,34,"Par exemple, un contrat de mutuelle santé peut être signé de façon électronique dès lors que l’employeur n’a pas besoin d’un logiciel de gestion. Le contrat prend ainsi beaucoup moins de temps à signé. De plus, l’employeur peut aussi imposer de nouveaux documents lors des visites médicales, comme une demande de déclaration de maladie.",0.090706694715,,,</s>,fr
34,on_p50,1000,1,35,"D’après l’examen réalisé, les deux vidéos ne sont pas des photos mais des candidatures pour le concours Mogate Fashion.
En effet, la filiale du dossier, Mogate Fashion, s’est montrée très sérieuse en examinant les dossiers de candidature. Elle a recensé les critères et les qualités à mettre en avant pour",0.090706694715,,,</s>,fr
35,on_p50,1000,1,36,"En effet, le tapis qui est en cuivre est certes très doté en élasticité, mais cela a pour effet de diminuer votre utilisation de votre tapis.
De plus, les tapis peuvent avoir tendance à s’éloigner ou à craquer sur votre tapis, ce qui peut être un réel problème si vous utilisez ce mobilier dans",0.090706694715,,,</s>,fr
36,on_p50,1000,1,37,,0.090706694715,,,</s>,fr
37,on_p50,1000,1,38,"Des données sur la prise en charge des personnes âgées dans les maisons de retraite en France : enseignements et perspectives par Dominique Morand, positionnement de la HAS par Marie-Joëlle Réauté, circulation des informations entre professionnels de santé par Marie-Joëlle Réauté, culture de la déminéralisation? (",0.090706694715,,,</s>,fr
38,on_p50,1000,1,39,"Le gouvernement, en accord avec la Confédération helvétique, a déjà reconnu officiellement le statut de la Suisse comme Etat membre de l’Union européenne à compter du 1er janvier 2016.",0.090706694715,,,</s>,fr
39,on_p50,1000,1,40,"Les deux familles suivantes, dites Fabrizia et Fabrizio, ont été relevées dans les années 1930 comme étant des personnes qui avaient des professions de taille réduite, et qui étaient membres de la famille dans la plupart des cas. Quelle est la différence de revenu entre Fabrizia et Fabrizio?",0.090706694715,,,</s>,fr
40,on_p50,1000,1,41,"3. Issu de M. le Professeur Jean-Marie Le Guen, Docteur en Sciences de l'Information et de la Communication
La santé mentale, c'est l'image que nous avons de nous-mêmes, de notre vie, de notre corps, de notre société... Le regard porté sur nous, sur le monde, sur le corps,",0.090706694715,,,</s>,fr
41,on_p50,1000,1,42,"Il y a vingt-cinq ans, la France pouvait compter sur une multitude de talents. Mais aujourd’hui, seuls cinq de ces talents se partagent la scène, celle de la télévision. Parmi eux, le talent de Laurent Ruquier en première dame. Tandis que Dorothée de la Croix, la gagnante du concours Touche",0.090706694715,,,</s>,fr
42,on_p50,1000,1,43,"Les loques sont un ensemble de sucres possessifs, de la glucose et d’un apport énergétique important, un peu plus qu’un repas.
La Loque est à l’origine de nombreux symptômes liés au diabète. Il s’agit d’une toxine bactérienne, qui est responsable de la formation de plaques d’athéromes dans les vaisseaux",0.090706694715,,,</s>,fr
43,on_p50,1000,1,44,"H Amanda, Que do you mean by the armor that you have I thought it was a certain armor that the original creator of the Arrows had purchased. I know that all the armor that the original creator of the Arrows had purchased of other people, has these magical armor that use the same magic that all of us",0.090706694715,,,</s>,fr
44,on_p50,1000,1,45,"La Saison de l’ Alliance est une série d’actions spectaculaires rassemblant des milliers d’appareils de toutes sortes, entre autres le Phare, le Grand Porteur et le Messager, ainsi que l’Orbite, le Portique et l’Orbuste. Le Messager (Xbox One, PS4",0.090706694715,,,</s>,fr
45,on_p50,1000,1,46,"Charli est un jeune et belle joueuse. Elle joue pour le club de tennis de Mont-Saint-Michel. Elle a fait la connaissance de son entraîneur, Mr Blandine et a vite compris que le tennis est pour elle un véritable métier. Elle a même commencé à jouer aux côtés de son entraîneur.",0.090706694715,,,</s>,fr
46,on_p50,1000,1,47,,0.090706694715,,,</s>,fr
47,on_p50,1000,1,48,"Qu'est-ce qu'elle fait?
- Elle mange.
- Elle mange?
Intéressant.
Je suis content de te lire.
- C'est le seul?
- Y a des lapins de poulet ici?
- Soirée tranquille, c'est bon.
- Soirée tranquille?
J'étais censé avoir des infos.
Je me retourne.
Entre",0.090706694715,,,</s>,fr
48,on_p50,1000,1,49,"L’électrique peut être installé dans toute la maison, dans la salle de bain, le garage et dans les chambres. Il est recommandé d’installer l’éclairage électrique dans la cuisine.",0.090706694715,,,</s>,fr
49,on_p50,1000,1,50,"Oh, yeah, I’m sure you’ll have your fill, Harry.
Eight times out of ten, I can afford that.
You know, like, five years, you know.
You know what that means.
You got some kind of paper that I can’t find?
At least I can get you one, and you",0.090706694715,,,</s>,fr
50,on_p50,1000,1,51,"La terre, les plantes, le feu, les poissons, les abeilles, les bêtes…… sont autant de témoignages que l’on peut écouter et ressentir.",0.090706694715,,,</s>,fr
51,on_p50,1000,1,52,"Les deux domaines de l'acupuncture sont très proches. Il faut donc en tenir compte avant de pratiquer la méthode de la médecine pour l'organisme en tant que tel.
C'est un lieu pour se reposer et prendre soin de soi. Le corps humain est aussi un environnement qui permet de recevoir. Il s'agit donc d'un espace de repos mais",0.090706694715,,,</s>,fr
52,on_p50,1000,1,53,"Les bois ne peuvent pas être grossièrement taillés en pierre car ils sont particulièrement lourds. Les blocs de chaux sont plus légers que ceux des pierres.
Les bois peuvent être taillés sur place, ce qui signifie que les pierres ne seront pas importés. Un polycarbone est fabriqué à partir de",0.090706694715,,,</s>,fr
53,on_p50,1000,1,54,"D’un côté, le contenu de ces subventions est plutôt faible. Il n’est d’ailleurs pas rare de voir des subventions de l’ordre d’un millier d’euros seulement (pour le cas de la piscine). D’autre part, ces subventions sont souvent honorées grâce à des allocations de la ville. Ce qui est le cas des communes locataires",0.090706694715,,,</s>,fr
54,on_p50,1000,1,55,"Proche de la commerciale et des écoles, à 1 min à pied de toutes commodités, terrain constructible et viabilisé d'environ 510 000 m2.
Sur les hauteurs du village de Viseux à 4 minutes du centre ville, à 17 km de Paris, cette maison de ville est idéale pour les familles avec",0.090706694715,,,</s>,fr
55,on_p50,1000,1,56,"• Protéger les rideaux métalliques de votre magasin le plus rapidement possible. Notre équipe de dépannage en miroiterie, installation de porte, réparation de porte, réparation de volets roulants à manivelles, motorisé ou motorisé à manivelles. La serrure de votre magasin",0.090706694715,,,</s>,fr
56,on_p50,1000,1,57,"I. INTRODUCTION
A natural question in the field of communications research is to study the time evolution of the time delay in a wireless system. In this case, we use the concept of superposition of symbols, that is, the frequency-encoding of sequences of symbols such that the resulting signal is not time",0.090706694715,,,</s>,fr
57,on_p50,1000,1,58,"Quand il s’agit de déco un peu colorée, on ne le cachera pas, autant que les résultats peuvent surprendre! Véritable symbole de l’art, les décorations déco sont tout à fait réconfortantes au quotidien. On peut les intégrer au sein d’un intérieur, sous forme de lampes, d’échop",0.090706694715,,,</s>,fr
58,on_p50,1000,1,59,"Les 34 recettes de pâte brisée sont mises en scène au fil des saisons grâce à des recettes simples et rapides à réaliser.
Mélangez farine, sucre, oeufs, poudre d’amandes et levure. Versez ensuite la préparation laitière pâtissière dans la cuve du robot, puis fouettez le",0.090706694715,,,</s>,fr
59,on_p50,1000,1,60,"En matière de législations en matière de sommeil, les dispositions de la loi sur la protection de la vie privée dans le domaine de la santé ne sont pas toujours adaptées aux mœurs des utilisateurs de services numériques. Il n’est pas toujours évident de comprendre les règles de protection de la vie privée lorsque l’on utilise un site web,",0.090706694715,,,</s>,fr
60,on_p50,1000,1,61,"Yakubiv (Vatnishkhush) [Danish name: Yaksubiv] est la station balnéaire dernière née de la côte nord, sur la côte septentrionale du pays.",0.090706694715,,,</s>,fr
61,on_p50,1000,1,62,"Dans la continuité de l’actualité du Mondial, la Cité de la Mode, architecture moderne et contemporaine, s’est jointe au concours international Google Street View des villes pour la création d’un nouveau concept de carte interactive, kiosque d’information et de tendances mis à disposition des automobilistes et piétons. Cette nouvelle carte interactive, présentée",0.090706694715,,,</s>,fr
62,on_p50,1000,1,63,"Voici quelques exemples de meubles testés par des experts : mobiliers à chaise, coffres, fauteuils et bibliothèques.
A savoir : le mobilier moderne et ultramoderne ne sont pas forcément les meilleurs pour la décoration intérieure. Et leur coût dépend de nombreux facteurs.
Dans le monde de la décoration,",0.090706694715,,,</s>,fr
63,on_p50,1000,1,64,"Vous avez accès à une page dédiée aux produits et services de votre entreprise. Vous y trouverez toutes les informations sur vos clients, vos produits, vos services, vos promotions, etc.
Vous pouvez personnaliser vos pages grâce à l’outil de personnalisation effectué par vos soins. En effet, il est possible de répondre",0.090706694715,,,</s>,fr
64,on_p50,1000,1,65,"List des capitaines des Royal Canadians
Antoine Côté (1565-1627)
16 avril 1688
17 mars 1692
Charles Dabo (1623-1688)
16 décembre 1694
17 février 1696
Charles-Émile Monfort (1661-1691)
17 juillet 1698
",0.090706694715,,,</s>,fr
65,on_p50,1000,1,66,"As well, the evening was filled with a class packed with new and older friends. We had a wonderful time meeting new people, experiencing life with a different perspective, and learning a new skill.
We had our first meeting in June. We spent a little time talking, which was great, but at the same time,",0.090706694715,,,</s>,fr
66,on_p50,1000,1,67,"Il existe beaucoup de manières de découvrir les préceptes du yoga. L'une des raisons pour lesquelles nous pouvons ressentir la force, la paix, et la joie de vivre du yoga est le fait de découvrir les secrets mêmes du yoga. C'est pourquoi, je vous invite à découvrir ce livre, le Yoga dans ton corps",0.090706694715,,,</s>,fr
67,on_p50,1000,1,68,"Oh, yeah.
I was thinking of something else.
Well, what are you doing here?
You need some time to think.
I was thinking that I'd...
Okay.
This is important to me too.
I'm sorry.
I'm sorry.
But I really want to get married.
I have to.
It's the last time you're",0.090706694715,,,</s>,fr
68,on_p50,1000,1,69,"Les collections de peintures d'Henri Becquerel sont organisées entre 1996 et 2010 par le centre muséal du Louvre, cet ensemble de 43 peintures a été commandé par la Fondation Jérôme Seydoux en 2001, et est conjointement administré par la Fondation France-Venezuela.",0.090706694715,,,</s>,fr
69,on_p50,1000,1,70,"Ce légendaire livre, compte tenu de sa rareté, a été écrit en arabe. C’est la deuxième œuvre majeure de l’écrivain algérien Mohamed Boudiaf, à laquelle il consacre une langue et une éthique de la lecture et de l’écriture « dans laquelle le choix de la voix et la langue sont liés",0.090706694715,,,</s>,fr
70,on_p50,1000,1,71,"L’ancien DT, directeur des formations et des annuaires, François Troupe, est décédé ce mercredi 19 juillet au CHU de Saint-Étienne. Il a découvert ses talents de juriste, lui ayant permis d’acquérir une certaine notoriété. L’ancien vice-président de l’Université Catholique de Saint-Etienne (UCS",0.090706694715,,,</s>,fr
71,on_p50,1000,1,72,"Conception, commercialisation et configuration d'un capteur photovoltaïque pour l'étude de l'évolution de la température dans une fenêtre solaire
Résumé : Les systèmes frigorifiques sont aujourd'hui la solution de stockage de produits alimentaires et de boissons de qualité. Leur performance énergétique, leur coût de construction et leur impact sur l'environnement et la santé sont bien connus.",0.090706694715,,,</s>,fr
72,on_p50,1000,1,73,"Le Petit Prince se contente de décrire un monde où « seule la jeunesse est intelligente ». Il dénonce le rôle joué par les gouvernants, dans « une société de consommation effrénée, où chacun est pétri de richesses, de talents et de richesses. »
Dans le monde de la finance, certains articles rapp",0.090706694715,,,</s>,fr
73,on_p50,1000,1,74,"Cette deuxième plateforme intègre une fonction de navigation rapide. De plus, les utilisateurs peuvent comparer des prix pour comparer une offre. Pour éviter certaines erreurs, vous pouvez également vous rendre sur l’app mobile pour obtenir des informations plus détaillées sur le produit.",0.090706694715,,,</s>,fr
74,on_p50,1000,1,75,"Pour la rentrée, nos jeunes rugbymen emblématiques ont été mis en compétition et nous ont donné rendez-vous à la fête de la musique. Pour cela, ils ont fait les choses en grand et ont participé à l’élaboration de leur programme de compétition.
Nous avons eu la chance d’avoir à notre disposition un studio photo, une bibliothèque",0.090706694715,,,</s>,fr
75,on_p50,1000,1,76,"Cette catégorie regroupe les travaux qu'il est possible d'établir à partir des résultats des réglementations. Il s'agit de tous les travaux qui ne relèvent pas des dispositions réglementaires.
Ce sont les travaux qui ne sont pas directement liés au fonctionnement du matériel des transports publics, mais qui ont un effet ou une influence sur le fonctionnement des transports publics.",0.090706694715,,,</s>,fr
76,on_p50,1000,1,77,"El Girondins de Bordelais est sur le point de réussir un exploit en se déplaçant en Coupe d'Europe en battant le Real Madrid 3-2 lors de la dernière journée d'établissement.
A la tête de la Coupe d'Europe face au Real Madrid, l'attaquant a signé un doublé, tandis que Victor Stéphan a",0.090706694715,,,</s>,fr
