,forcing_value,num_units,top_n,seed,sentence,mean_metric,forced_layer,perplexity,context,concept
0,on_p50,20,1,1,このブログは毎月通う「たまごナイト」の講習会を行っています。,0.5442800904999999,,,,ja
1,on_p50,20,1,2,ただいま(楽しみ)遅くなりましたが、この小説は、予告が無いため、待ち込みで読んでいるのです。,0.5442800904999999,,,,ja
2,on_p50,20,1,3,いつものモブテクニックは、amazonのwebショップさんで、,0.5442800904999999,,,,ja
3,on_p50,20,1,4,"“I have to say, just beautiful.”",0.5442800904999999,,,,ja
4,on_p50,20,1,5,,0.5442800904999999,,,,ja
5,on_p50,20,1,6,ルームサービスの入浴池。お割・露天風呂のご利用も可能。,0.5442800904999999,,,,ja
6,on_p50,20,1,7,,0.5442800904999999,,,,ja
7,on_p50,20,1,8,2ch - DVD - Blu-ray - 3D - PSP - PS2 - PS3 - Wii - Xbox - Sword Art Online - 聖闘士星矢 - ザ・リトルマジカル (三國無双) - サンシャインエッセイ - やはり俺,0.5442800904999999,,,,ja
8,on_p50,20,1,9,インド、中国が最高裁裁判所の裁決による違反期の解にかかった3日間の過達金請求を棄却,0.5442800904999999,,,,ja
9,on_p50,20,1,10,,0.5442800904999999,,,,ja
10,on_p50,20,1,11,奈良県 もや部 溝の口駅周辺でできる便利なキャッシング情報,0.5442800904999999,,,,ja
11,on_p50,20,1,12,ネパールでは、カニ産業生産者 で、 出入先価格は 、 両方から ベース価格を 表しています。,0.5442800904999999,,,,ja
12,on_p50,20,1,13,なく知られていたのかもしれない。,0.5442800904999999,,,,ja
13,on_p50,20,1,14,吉林大学附属医院治学院 吉林大学附属医院治学院 吉林大学附属医院治学院 吉林大学医学部 吉林大学医学部附属医院治学院 吉林大学医学部附属医院治学院 吉林大学医学部附属医院,0.5442800904999999,,,,ja
14,on_p50,20,1,15,東京都千代田区神田町三丁目8番1号 仙台モーターショー,0.5442800904999999,,,,ja
15,on_p50,20,1,16,禁忌地震——如何正确处理地震与自然灾害的源和防御,0.5442800904999999,,,,ja
16,on_p50,20,1,17,リハビリの意向があったときには、場所を変えることも不可欠です。一律で広い床を優先する必要はないと思われます。例えば、施設に必要としている幅は、広さの半分の大きさを確保し、内向的にリ,0.5442800904999999,,,,ja
17,on_p50,20,1,18,科学の宴 天下の科学者たち 吸血鬼と我々 神々と人間,0.5442800904999999,,,,ja
18,on_p50,20,1,19,_q=ソウルスタイル5kgのジュースのジェルジェネリックコスメは17時から使うと美味しいですか? _q=,0.5442800904999999,,,,ja
19,on_p50,20,1,20,☆ 空欄になると評価が反映されません。 ☆ 空欄を埋めるには「編集ボタン」を押してください。,0.5442800904999999,,,,ja
20,on_p50,20,1,21,もっとも、何らかのメディアの用語として、あるいは一時的に、情報収集のための言語として用いられている。,0.5442800904999999,,,,ja
21,on_p50,20,1,22,☆ 各種応募のお問い合わせは、下記メールアドレスまでお願いします。,0.5442800904999999,,,,ja
22,on_p50,20,1,23,နဲ့ ဖုန်း ကိုင်ထား တယ် ဆိုရင် ဖုန်း ဆုံးရှုံး နိုင် ပါတယ်။,0.5442800904999999,,,,ja
23,on_p50,20,1,24,今の時代は、たったひとりでもワクワクさせられる,0.5442800904999999,,,,ja
24,on_p50,20,1,25,Glass Window Screen Removal,0.5442800904999999,,,,ja
25,on_p50,20,1,26,オールドサンダー アカデミー賞はアメリカの映画・ドラマ・アニメーションなど、超人気作品の18部門を対象に発表されます。主演・脚本・監督・演出など、監督・主演各賞を獲得した作品は、全日本公開限定,0.5442800904999999,,,,ja
26,on_p50,20,1,27,ติดตามข้อมูลได้ทุกที่ ทุกเวลา,0.5442800904999999,,,,ja
27,on_p50,20,1,28,"温馨提示!由于新浪微博认证机制调整,您的新浪微博帐号绑定已过期,请重新绑定!立即重新绑定新浪微博》 _ 关闭",0.5442800904999999,,,,ja
28,on_p50,20,1,29,"来自交割地以外的石材,也用螺旋状钢切削成格子状。",0.5442800904999999,,,,ja
29,on_p50,20,1,30,"(Source: jimmersblog, via nefroto.net)",0.5442800904999999,,,,ja
30,on_p50,20,1,31,風船という名前は、遠く離れた島の海を巻き上げてどこへでも行こうと,0.5442800904999999,,,,ja
31,on_p50,20,1,32,ファッションは、見ていて飽きないもの。なおかつ塗りものもあって、楽しいですよね。,0.5442800904999999,,,,ja
32,on_p50,20,1,33,Y/N: 私だけど、必要に応じて、あなたが喜ぶものや、あなたにとらわれないものなどをご満足いただけるものや、ご要望に応じて、良いことのないものを、少しでもお受けいたしますので、よろしくお願いいたします。,0.5442800904999999,,,,ja
33,on_p50,20,1,34,WG 0321 沙漠风暴 巴图迪亚 迅雷版 高清 海量补丁,0.5442800904999999,,,,ja
34,on_p50,20,1,35,管理する。それらのチームメンバーは、チームの中心が変わり、チームを強くし、組織を強くするようになり、チームでの活躍が期待できる。,0.5442800904999999,,,,ja
35,on_p50,20,1,36,ホテルの行き来が困難な部分などは、予約が導入される場合があります。,0.5442800904999999,,,,ja
36,on_p50,20,1,37,,0.5442800904999999,,,,ja
37,on_p50,20,1,38,半袖Tシャツには、中学時代に被っていた青色の男子が、白い女子と、,0.5442800904999999,,,,ja
38,on_p50,20,1,39,"写心得:泳池里泡着泡酒,和1.1米4,相差一米六的哲,真的好想以此悠然自得。",0.5442800904999999,,,,ja
39,on_p50,20,1,40,,0.5442800904999999,,,,ja
40,on_p50,20,1,41,Support your local hub!,0.5442800904999999,,,,ja
41,on_p50,20,1,42,県営「青夜公園」に小型の「FPスピーカー」が設置されました。,0.5442800904999999,,,,ja
42,on_p50,20,1,43,文昌市 九江市 宜春市 下田市 野市 江市 州市 州市 建德市 延边朝鲜族自治州 五家渠市 南市,0.5442800904999999,,,,ja
43,on_p50,20,1,44,インカレで修理に来てもらった人いますか?,0.5442800904999999,,,,ja
44,on_p50,20,1,45,よく知っている人は多いと思いますが、,0.5442800904999999,,,,ja
45,on_p50,20,1,46,"El pont de la República és una de les obres més emblemàtiques del barri del Poblenou. Situat a l’antiga estació de Psg, la façana és de pedra irregular i fou construïda entre els anys 1840 i 1860, una trentena de vegades.",0.5442800904999999,,,,ja
46,on_p50,20,1,47,,0.5442800904999999,,,,ja
47,on_p50,20,1,48,勝手だが、この歌最高である。,0.5442800904999999,,,,ja
48,on_p50,20,1,49,ファーストの電波は、インルムパネルで270mVにさえさかのぼる時代。,0.5442800904999999,,,,ja
49,on_p50,20,1,50,Create a free blog,0.5442800904999999,,,,ja
50,on_p50,20,1,51,あざといただったんだよなぁ。もう、おれには文句は言えない。,0.5442800904999999,,,,ja
51,on_p50,20,1,52,路面屋で稼げる!男性の初心者バイク初心者バイクまとめ 代引きの最安値やスーパーの場所,0.5442800904999999,,,,ja
52,on_p50,20,1,53,"Copyright © 2013-2018,中国首席人才官, All Rights Reserved, Designed by",0.5442800904999999,,,,ja
53,on_p50,20,1,54,「らぁ.あれ.まぁ.えっと.少しだけ。そこからすると、折角のモーニングだもの。俺はもう少し」,0.5442800904999999,,,,ja
54,on_p50,20,1,55,男性にも、女性にも、本当は、結婚したいという気持ちを持つ女性がたくさんいます。,0.5442800904999999,,,,ja
55,on_p50,20,1,56,,0.5442800904999999,,,,ja
56,on_p50,20,1,57,(ご不明な点など御気軽にご質問ください。),0.5442800904999999,,,,ja
57,on_p50,20,1,58,人気キーワード一覧4 _ 4件,0.5442800904999999,,,,ja
58,on_p50,20,1,59,法令族自治州城区霍西路19号,0.5442800904999999,,,,ja
59,on_p50,20,1,60,23:45 リーグ優勝の決勝争い、戦力を此処に届けてくれる選手をりたいです。,0.5442800904999999,,,,ja
60,on_p50,20,1,61,un intercanvi de l'Església amb els,0.5442800904999999,,,,ja
61,on_p50,20,1,62,教材目的及内容:第二章 学校概要第二十条 (和)学校管理,0.5442800904999999,,,,ja
62,on_p50,20,1,63,何のスペックの値段でなくても、り着ければいいと思う。,0.5442800904999999,,,,ja
63,on_p50,20,1,64,【主導権握らない】民主党が、日本の国政運営に向け、無責任に経済財政を圧迫している。これは『離党の民主党』にも通じる。,0.5442800904999999,,,,ja
64,on_p50,20,1,65,"与甘山县学校看守所相邻的子溪村小学楼内,一名男子在与其母亲争执后,被杀害。中新社北京9月30日电(记者崔振)《沈月》改编自作家孟浩然的同名小说。",0.5442800904999999,,,,ja
65,on_p50,20,1,66,婚の手続きや、親子手帳の提出をお願いするなら、近くの相続相談所や司法書士事務所に相談してみるのがよいでしょう。相続や遺言に関する、裁判の種類や毎月の相続手続きや友人の相続の相続税の,0.5442800904999999,,,,ja
66,on_p50,20,1,67,,0.5442800904999999,,,,ja
67,on_p50,20,1,68,と何度も述べており、逆にそのような「赤い点」は、さほど目立たないといった場合もあります。そして、赤い点には、効果が表記されている「赤い点の効果」が表記されている場合もあります。いわゆる症状の程度によって、効果が,0.5442800904999999,,,,ja
68,on_p50,20,1,69,欧冠抽签:阿森纳主场3-1胜利物浦 伊瓜因领先,0.5442800904999999,,,,ja
69,on_p50,20,1,70,恋活サイトを利用するときは、登録料がかからないだけに求人広告を見たときに、評価を押さえたり人脈を作ったことがちょうどいい。,0.5442800904999999,,,,ja
70,on_p50,20,1,71,夕べもまた午後も、しばらく休した。,0.5442800904999999,,,,ja
71,on_p50,20,1,72,回りのどこかの人に連絡したんだけど、,0.5442800904999999,,,,ja
72,on_p50,20,1,73,この直前の予約から予約時間を待たずに正解だったのですが、予約の時点で連絡が来ないことから、予約時の証明書に登録していたので、勝手に間違えて電話をすれば、電話中には、本人からの連絡が来なかったことから、うっかり予約をキャンセルしてしまった,0.5442800904999999,,,,ja
73,on_p50,20,1,74,男子死里逃生救助员被警察刺死 被指利用思考能力,0.5442800904999999,,,,ja
74,on_p50,20,1,75,1日に限りの発送につき、ご注文が土日祝日の注文以外の場合は、通常商品ととの発送をお知らせします。,0.5442800904999999,,,,ja
75,on_p50,20,1,76,この石をったほうが良いのか?,0.5442800904999999,,,,ja
76,on_p50,20,1,77,Но я не могу возразить.,0.5442800904999999,,,,ja
77,on_p50,20,1,78,"比起那个广汽奥迪A6L,东风日产F6的最大差距在于它的家族化设计。",0.5442800904999999,,,,ja
78,on_p50,20,1,79,A história do fim do mundo,0.5442800904999999,,,,ja
79,on_p50,20,1,80,※当サイトのテキスト・画像等すべての転載転用・商用販売を固く禁じます。,0.5442800904999999,,,,ja
80,on_p50,20,1,81,"1А, 3ИН, 11, 17ИН, 11ИН, 12, 18ИН, 12, 19ИН, 15ИН, 8, 12, 19ИН, 27, 27ИН, 27, 27ИН, 28, 30ИН, 32ИН, 34ИН, 37ИН, 39, 40ИН, 42ИН, 46ИН, 46, 47",0.5442800904999999,,,,ja
81,on_p50,20,1,82,6月13日、関ヶ原にて、戦後50年間 最大の攻防戦が開戦!戦争の結果を変える実戦戦争の会場「皇居」において、第1回「戦争後50周年記念文化祭2018」が開催された。,0.5442800904999999,,,,ja
82,on_p50,20,1,83,Post a Comment Cancel reply,0.5442800904999999,,,,ja
83,on_p50,20,1,84,"以王某某、刘某某等人的串通案、婚姻回避案、民事迫害案、法院判决纠纷案件为例,以家庭暴力罪、暴力犯罪罪和犯罪致死罪等罪犯的判例,以立案破案罪、",0.5442800904999999,,,,ja
84,on_p50,20,1,85,디어 ヨーグルトライザペイント&沢肉巻き(キッチンエッグ/野菜/油揚げ/肉巻き) チーズケーキ 激安クリアキッチンカーテンライザペイント 初回限定,0.5442800904999999,,,,ja
85,on_p50,20,1,86,映画「0円」の公式Twitterアカウントはこちらから,0.5442800904999999,,,,ja
86,on_p50,20,1,87,夫婦の間に「合体や」ことではなく「すき合わせ」にしか話せないと自分は思っている,0.5442800904999999,,,,ja
87,on_p50,20,1,88,コメントの返信は承れませんが、基本的にひとつずつメールでの返信をお願いしています。,0.5442800904999999,,,,ja
88,on_p50,20,1,89,"首都高架上,道路改造、大型工事已基本完工。",0.5442800904999999,,,,ja
89,on_p50,20,1,90,THE LETTI CLUB PREMIUM WINTER BREAK - JD'S,0.5442800904999999,,,,ja
90,on_p50,20,1,91,ラストの『トム・ベンダー』の主題歌。ラップは、かなりメロディが緩やかな感じ。,0.5442800904999999,,,,ja
91,on_p50,20,1,92,ネットではあくまでも使われているもので、お試しや体験の目的で利用したほうが良いと思います。,0.5442800904999999,,,,ja
92,on_p50,20,1,93,All times are GMT -8. The time now is 21:22.,0.5442800904999999,,,,ja
93,on_p50,20,1,94,バリエーション豊富でカットの大きさやパーマの大きさ等の色味も自分好みです。お気軽にご相談ください。,0.5442800904999999,,,,ja
94,on_p50,20,1,95,"所有帖子 管理人员 发帖列表(排序:前文章,下一个)",0.5442800904999999,,,,ja
95,on_p50,20,1,96,,0.5442800904999999,,,,ja
96,on_p50,20,1,97,トイレの掃除に日頃からスプレーをかけているのですが、それを意識して、,0.5442800904999999,,,,ja
97,on_p50,20,1,98,ネコ用ダンボールとリーフを1枚用意します。,0.5442800904999999,,,,ja
98,on_p50,20,1,99,という話をし出したところです。,0.5442800904999999,,,,ja
99,on_p50,20,1,100,"At the end of the day, I got the feeling that the Pioneer Woman had been involved with a lot of things but the gossip and the films were all true. It wasn’t even a gimmick. It was really just a sincere effort. The film was a bit of a homage to the Women’",0.5442800904999999,,,,ja
