,forcing_value,num_units,top_n,seed,sentence,mean_metric,forced_layer,perplexity,context,concept
0,on_p50,20000,1,1,"是安全性,适用时应采取常规的使用。 可用于叉和运输包装上。",0.37540087206965,,,,zh
1,on_p50,20000,1,2,提供了良好的服务和采购管理平台与产品的发展。C最强无呢?,0.37540087206965,,,,zh
2,on_p50,20000,1,3,注注注:若握子贴是回个创新的话请下你的朋友就立刻使用吧,0.37540087206965,,,,zh
3,on_p50,20000,1,4,,0.37540087206965,,,,zh
4,on_p50,20000,1,5,的助手一个个的出现在了剧场上。,0.37540087206965,,,,zh
5,on_p50,20000,1,6,"是回归杯赛入门训练。回归杯赛进入到西门时,科罗拉足球俱乐部老板兼主帅一直在眼上就是那么一个冠军杯冠军。可现在的故事全然不上门球。为是以前是发了球自由到停一次回到球门不",0.37540087206965,,,,zh
6,on_p50,20000,1,7,,0.37540087206965,,,,zh
7,on_p50,20000,1,8,喷无过性病是一种发于该种疾病包括遗传性感染以及免疫损伤。它是发生了的发作的性发病。它不是其效应是诱在体内总和神经系统。,0.37540087206965,,,,zh
8,on_p50,20000,1,9,红色大颗粒团结博彩默默作为朋友。,0.37540087206965,,,,zh
9,on_p50,20000,1,10,"是四号,正直的京做处而不解决?!有点奇怪。",0.37540087206965,,,,zh
10,on_p50,20000,1,11,中奈不得酸指南道部的德顺和御县道部三名都很详细。,0.37540087206965,,,,zh
11,on_p50,20000,1,12,"在线时尚纪念录取节【快搜生录取 未来生物 出入过程,我们的回来后可能是最后一个的。每天晚上,你都在开着你的车的。",0.37540087206965,,,,zh
12,on_p50,20000,1,13,"这个名为大戒玩法, 友来说来说同谢一下吧。这款打个100个名为黑叉,只能用来玩那种版本里。这个带自己在逛逛那种地图带个地图家就可以",0.37540087206965,,,,zh
13,on_p50,20000,1,14,?你在那里呆得太远了?不会接到你的这个的,0.37540087206965,,,,zh
14,on_p50,20000,1,15,"为了让客户拥有更多选择和根据应变速度,我们讨了多多借愿去了解更多关于可翻页技术。 请参考我们的网站。我们是很多场所在使用【可翻页技术多种方式来复选一个本站下次访问。如果我们的网站不符合我们的",0.37540087206965,,,,zh
15,on_p50,20000,1,16,禁忌的是——精精控女帝罪极极大的猎物啊。,0.37540087206965,,,,zh
16,on_p50,20000,1,17,"我们的道是我们的导游向广播说的神奇的罗斯华之门道,然后一律遵循规则我们一个个过去晚和过去的,我们会受行的习惯和与敬畏,我们会受良好的沟通和细致的训练,他们会受我们自己向来不",0.37540087206965,,,,zh
17,on_p50,20000,1,18,"科学家,科学家,科学家......人吸入过小我部于生物基基复复吸入在早期和大多手脚跟等能吸入过小我部中的。由于到晚份的无机和无生物基复复吸入。人工染色基调",0.37540087206965,,,,zh
18,on_p50,20000,1,19,从没缩少过因为你这样的人对你做过的女人吗?,0.37540087206965,,,,zh
19,on_p50,20000,1,20,"的剑拔在于它在娜刹上的出现时,人的传播、传播和传播的节奏和速度之间是很大的不同。它在娜刹上出现时,的剑拔在于它在娜刹上呈现时,的剑拔在于它只会用的形状为乌龟和黑色的",0.37540087206965,,,,zh
20,on_p50,20000,1,21,有水分循环早看不上用吗?,0.37540087206965,,,,zh
21,on_p50,20000,1,22,"由于缺乏相关产品或缺少推广的支持,因此有很多重复产品。",0.37540087206965,,,,zh
22,on_p50,20000,1,23,备份的记得贝中的大部分的。,0.37540087206965,,,,zh
23,on_p50,20000,1,24,"有点的突破了。虽然没有超神界界之大风过过多的火属性,但是超神界界之大风中那些属性很高。现在这个对比来说。",0.37540087206965,,,,zh
24,on_p50,20000,1,25,也有中国、澳大利亚等过多的对其要求和应当负欢迎。,0.37540087206965,,,,zh
25,on_p50,20000,1,26,的两个了。远不够靠在木偶身上。,0.37540087206965,,,,zh
26,on_p50,20000,1,27,上榜中心第二大百家乐获得最多在永夜中观看海量免费电影观看总量超过一千万首。,0.37540087206965,,,,zh
27,on_p50,20000,1,28,,0.37540087206965,,,,zh
28,on_p50,20000,1,29,也见到于其他同学中石老师的时候也用很精致的的表达手册的于大家跟你们这边做一个小小的體驗吧.,0.37540087206965,,,,zh
29,on_p50,20000,1,30,"(主要产品主要产品主要产品:贵阳电线电缆。安徽移动、电信联穿插式。媒体海量。自营业务运营。和与用户协议。,还收到了相关和运营商的版权归属。进行现代网络形象。。。App好,可以作为街拍、",0.37540087206965,,,,zh
30,on_p50,20000,1,31,的到来 更多人相信的,0.37540087206965,,,,zh
31,on_p50,20000,1,32,两者将将和对流人体气宝包裹的香浓浓浸泡着你及你的所有,0.37540087206965,,,,zh
32,on_p50,20000,1,33,"可见,我们主演的包了,在采访中导演还表示了空为王衣衫,他表示这不是自己的是太——都是自己的的,不应该接受,所以就说的我们会另外一个类型,就是喜新新垃的。《青青,青青",0.37540087206965,,,,zh
33,on_p50,20000,1,34,日前工大邀请沙堡牙丰报记录图复进行拍照。,0.37540087206965,,,,zh
34,on_p50,20000,1,35,"的 银行。你要相信的,我们是能的的的部落格,测试和教。。。的个月前刚结束。。。。。。 。。。。。。。。。。 。。很很很很。。。试试看。。。。。。内,就是各个网站",0.37540087206965,,,,zh
35,on_p50,20000,1,36,来到这大陷海时身上一一在袭波袭了对方的手。可惜那老者的手被那身子附着了居然没有吸这身子的人的手消失了。,0.37540087206965,,,,zh
36,on_p50,20000,1,37,,0.37540087206965,,,,zh
37,on_p50,20000,1,38,半熟于它的在预约的评被重新显示。,0.37540087206965,,,,zh
38,on_p50,20000,1,39,还是写作就应该这么多呢?,0.37540087206965,,,,zh
39,on_p50,20000,1,40,,0.37540087206965,,,,zh
40,on_p50,20000,1,41,"inpustili。和鱼的类别不同。鱼类生物非常多,是人们为了其美味而花大量时间在留的家中。但如果是无选择的动物,那么吃喝、补充一些易引起厌氧或者有无能的生殖器遗少的糖原岛是看不",0.37540087206965,,,,zh
41,on_p50,20000,1,42,旅客量比分析中中值。小官说的话得更多这辈子和俄罗斯。但在远处人即暗黑兵部。,0.37540087206965,,,,zh
42,on_p50,20000,1,43,后去更激发了。,0.37540087206965,,,,zh
43,on_p50,20000,1,44,"摄摄取量中时拥有大量食物,从而抵抗力下降。如果摄取量太过或者太少又太粗会导致脑的暗绿色至白色为灰色。",0.37540087206965,,,,zh
44,on_p50,20000,1,45,",最终决定在干一段时间后继续教育与继续的研究。",0.37540087206965,,,,zh
45,on_p50,20000,1,46,大错引引胡生日被后没有得到虚损失并使用斥与自认同一边记还是去流投奔的接到和者一步道被罪自己并尚加放之约后还上贴出声明能被撤其所主得已尽后剥夺非礼了之,0.37540087206965,,,,zh
46,on_p50,20000,1,47,,0.37540087206965,,,,zh
47,on_p50,20000,1,48,"从剑到刀,到完全融合到现在的我。",0.37540087206965,,,,zh
48,on_p50,20000,1,49,是提供更多感情的用户喜欢。为那么多人一起创业的的负责。,0.37540087206965,,,,zh
49,on_p50,20000,1,50,容灭开视极很迷糊的朋友救救～低沉色超级霸道,0.37540087206965,,,,zh
50,on_p50,20000,1,51,的光不断打在你的面前。,0.37540087206965,,,,zh
51,on_p50,20000,1,52,路桥的公司的贴经常总结如何开发新客户发展目标。,0.37540087206965,,,,zh
52,on_p50,20000,1,53,"然而这个时候却不是看见还是不见了,只是呈现的是一样的景色。",0.37540087206965,,,,zh
53,on_p50,20000,1,54,上字的.我又靠着着石门后背。在。,0.37540087206965,,,,zh
54,on_p50,20000,1,55,因而主之上统统就是以防卫2的介书。 叙说中也层层的注灌注,0.37540087206965,,,,zh
55,on_p50,20000,1,56,-帐帐帐帐帐帐帐帐帐帐帐帐帐帐帐帐帐帐帐帐帐帐算算算计。对应于招待语音S、开关快快快快快快快快快快快快快快快快快快快快快快快快快,0.37540087206965,,,,zh
56,on_p50,20000,1,57,阅读《法律的笼笼将刚创之汤汤托尔晴佛tū梅在官方网阅读道具阅读地球迟早会不会毁灭这个因为太软了这太了你的还记得当时吗?之前地球上还有太阳百万个里到不了地球一个小小的,0.37540087206965,,,,zh
57,on_p50,20000,1,58,",U开染没控制的回血流流法,如前提是你得控制的血流,所以建议勿过多服用。",0.37540087206965,,,,zh
58,on_p50,20000,1,59,法定程序和规定中流量共计在处理和含有【明示的报告内容的情况后不能执行的。,0.37540087206965,,,,zh
59,on_p50,20000,1,60,这座矿村大难归杂请把这些看起来光鲜了此手没有那么来不对!一个个人脸的态。但是你都说过所有权都被改变了你才有【?。你在那还是好你还想为她产生这么大后。,0.37540087206965,,,,zh
60,on_p50,20000,1,61,un无阴上夜被干的视频操的很紧,0.37540087206965,,,,zh
61,on_p50,20000,1,62,教主的求求和网友的批评都被了的和大家的帮帮的个很简单的。,0.37540087206965,,,,zh
62,on_p50,20000,1,63,"以慢如镜。只要在两天的书了两本单子,然后翻翻,就看了一篇文章。",0.37540087206965,,,,zh
63,on_p50,20000,1,64,"不不对,待在等后再说~~",0.37540087206965,,,,zh
64,on_p50,20000,1,65,"与甘山国家游客看不好,他们的看好的的是是是,我带这个团去的的。这个季节的人们的的都喜欢用这个中脚带路,就是请走程上的地方。自斗小型机车是经过了近半个月的试验后,",0.37540087206965,,,,zh
65,on_p50,20000,1,66,"少片的男性血液使用占比的首位是健康,却也,相较于少量,近几年增加了。也,血液是受影响,血流总、血液营保护和血感染的,应加强饮食友好,但若是使用又太",0.37540087206965,,,,zh
66,on_p50,20000,1,67,,0.37540087206965,,,,zh
67,on_p50,20000,1,68,"像古树你说、你说、你说。可能你多点自慰或者是我太太的干性射了,肉这些你边边干着太太把你的精液精液全部舔我的小穴然后又吐,然后甩出去发觉有小弟子你说",0.37540087206965,,,,zh
68,on_p50,20000,1,69,建议保险中保险额中线集合是过大。总之当你了解的在您的选择中有一个达到或没有达到下一个购物机会。,0.37540087206965,,,,zh
69,on_p50,20000,1,70,"一个年后,访问到他的家。 星期四求旅客的名字。我的朋友和爹告诉我后后语。 「你说你不是的的你在把它拿去那这个。她说你是个死去。碑的。我把它放在你的面前。他说你",0.37540087206965,,,,zh
70,on_p50,20000,1,71,",你可可以一概的和那一人对着干吗",0.37540087206965,,,,zh
71,on_p50,20000,1,72,"总来说,请提供一下审查中产生的处理方式和原则。",0.37540087206965,,,,zh
72,on_p50,20000,1,73,"直奔的是公立室的外面。正下管理室、电风风风浓郁。有三个房间、四个人,一个人用床,一个人用衣打打,一个人用牙牙牙牙牙牙牙牙牙牙牙牙牙牙牙牙牙牙牙牙",0.37540087206965,,,,zh
73,on_p50,20000,1,74,-矩后向下跳按一下。,0.37540087206965,,,,zh
74,on_p50,20000,1,75,后然于横看去海报完后自觉的增加了。电力未来之挪财邮招待券那你就完了。240封邮局邮号邮箱没有核过多或任何邮小类。很可怕。也正是因为现在电子邮件的发作的绿色速,0.37540087206965,,,,zh
75,on_p50,20000,1,76,石石楠木黑地下低可动性木材类化所属的木制的模型微型木屋。,0.37540087206965,,,,zh
76,on_p50,20000,1,77,来源标题:拥有地名就此来源标题:拥有地名就此来源:中国棋棋牌博娱乐城之必须明猜中而其他人则表示道道以外来源:可能太深了可以购买道身天之宝来源:可能太深了可以购买道身天,0.37540087206965,,,,zh
77,on_p50,20000,1,78,"是比起传统于以前的多,但是它不坚定于国内而发。",0.37540087206965,,,,zh
78,on_p50,20000,1,79,A只有的小被; 却被我拒斥。,0.37540087206965,,,,zh
79,on_p50,20000,1,80,"吗?其意思是,科学和技术的融合是高于宗教的包量。",0.37540087206965,,,,zh
80,on_p50,20000,1,81,的多铁血统和不会的的吧统后的两者。不过要想了一下还是能通通这么短的东西呢。超少不过。,0.37540087206965,,,,zh
81,on_p50,20000,1,82,的去由耶耶耶耶耶耶耶耶耶耶耶耶耶耶耶耶耶耶耶耶耶耶耶耶耶耶耶的住所那里。~,0.37540087206965,,,,zh
82,on_p50,20000,1,83,in希望教程回答速度的慢些来吧。,0.37540087206965,,,,zh
83,on_p50,20000,1,84,"以王威廉和他的后辈为综gusii的隐皇族,但是据说他到此后四城都被占了,不列其中的。",0.37540087206965,,,,zh
84,on_p50,20000,1,85,"这是一个几乎没有语言语言的代言上。“这听说过,你也不懂。",0.37540087206965,,,,zh
85,on_p50,20000,1,86,"其中为了0患和100%卫考参加,完结之后获得了 高级专科的。",0.37540087206965,,,,zh
86,on_p50,20000,1,87,夫人书籍・原刊等中中英文和电子杂杂志翻翻求量越来越大的打压手机电脑电脑不支持手机黑黑我的邮储太太邮播十几个小时里强大的邮邮邮测试测试测试版手机版绿色版下载多版本的邮邮软件,0.37540087206965,,,,zh
87,on_p50,20000,1,88,"。脱脂奶粉取其余那些固有脂肪含量比较低,不过能的全程营养来源于自然界中。不能经过考试的道路上走路跑车路上有没有到?",0.37540087206965,,,,zh
88,on_p50,20000,1,89,"的首度加入到设设杀手手道消息,",0.37540087206965,,,,zh
89,on_p50,20000,1,90,"和去帮大伙能设置物光点吗。以对约一个月的内最大能发射的只能是3光点,若不是3光点的话就以偏迟开过几个光点的日后光点将控制权掌握在自己手克。",0.37540087206965,,,,zh
90,on_p50,20000,1,91,已经被认为为轮流升级龙和小龙。并且发动了一次后上龙的技能。但是为了不被人伤于其中而被人将重力引到了上龙身上。,0.37540087206965,,,,zh
91,on_p50,20000,1,92,距离海约一个小时。位于在中国西部公路的洛阳路。设有四个临临时名店。,0.37540087206965,,,,zh
92,on_p50,20000,1,93,"还是还是那个在行间看见这个只和了一世界的两个个子的他们个和,是他们两个个子。毕业时,后学生初中时因为一个镜头上出现在他们的眼里。它是三个个子黄色的,一个是两个个世界的两个个神的",0.37540087206965,,,,zh
93,on_p50,20000,1,94,有用吗能用吗?你用的时果然还不错~,0.37540087206965,,,,zh
94,on_p50,20000,1,95,"一个阅读赠享用:短短发的,,十万的的。",0.37540087206965,,,,zh
95,on_p50,20000,1,96,,0.37540087206965,,,,zh
96,on_p50,20000,1,97,演文 考查书。格式版。事学英语第一册。新版。,0.37540087206965,,,,zh
97,on_p50,20000,1,98,"据了解,虹电池与虹光的代替之性是增加了新的性潜力,这种新性潜力可能导致干超在的吸氧量增加,也可能在无增加空气滤滤膜介被改变。吸氧量检测样样列了过少如色超",0.37540087206965,,,,zh
98,on_p50,20000,1,99,是守吗?保持一个活性呢?,0.37540087206965,,,,zh
99,on_p50,20000,1,100,还是要工资还包邮更容易得多。自以为很偏偏父母为地长大哥的岗位也是挺多。,0.37540087206965,,,,zh
